label,title,description,autor,date,url
Noticias,Cisco Talos señaló cuáles fueron las principales amenazas de ciberataque en el 2021,"Cisco Talos, la división de CiberInteligencia de Cisco, ha elaborado un listado de las principales amenazas de malware en 2021 clasificada por meses.",Daniel Jimenez,22 Dec 2021,https://cointelegraph.com/news/cisco-talos-outlined-the-top-cyberattack-threats-in-2021
Análisis,La transformación en el mercado de e-Sports y Games,El crecimiento de brasileños que juegan videojuegos impactó en más del doble contra estudios especializados en el sector entre 2018 y 2022,Rodrigo Di Paula Ambrissi,14 Nov 2022,https://cointelegraph.com/news/transformation-in-the-e-sports-and-games-market
Noticias,"El lavado de criptomonedas aumentó un tercio en 2021, pero sigue por debajo del récord","El informe de Chainalysis detalló cómo los ciberdelincuentes lavaron sus criptofondos en 2021 en comparación con el año anterior, y cómo los protocolos DeFi vieron el mayor aumento de uso.",Brian Newar,27 Jan 2022,https://cointelegraph.com/news/crypto-money-laundering-up-by-one-third-in-2021-but-still-below-record
Noticias,El regulador bancario estadounidense da una advertencia sobre las criptomonedas,"La Oficina del Contralor de la Moneda (OCC) afirmó que el sector de los activos digitales estaba madurando, pero que ""aún no era sólido"" en su gestión de riesgos.",Jesse Coghlan,09 Dec 2022,https://cointelegraph.com/news/approach-with-caution-us-banking-regulator-s-crypto-warning
Noticias,Hashdex y Nasdaq impartirán un curso gratuito sobre inversión con Bitcoin y criptomonedas,"El curso estará abierto a todos los profesionales financieros y está diseñado para proporcionar recursos informativos y educativos a los asesores financieros sobre el ecosistema de activos digitales en evolución, las consideraciones de inversión, la regulación, los impuestos y más",Cassio Gusson,03 Mar 2022,https://cointelegraph.com/news/hashdex-partners-with-nasdaq-and-will-give-free-course-on-bitcoin-and-cryptocurrency-investments
Noticias,Reconocida cadena de hamburgueserias en España incorpora el pago con criptomonedas,Un total de 16 restaurantes en España incorporan el pago con criptomonedas a través de Criptan.,Juan Abad,08 Mar 2022,https://cointelegraph.com/news/renowned-restaurant-chain-in-spain-incorporates-payment-with-cryptocurrencies
Noticias,DEX apunta a enfrentarse a Uniswap con su apuesta de liquidez concentrada,La liquidez concentrada se ha convertido en la última tendencia en el mundo DeFi con varios proyectos cambiando al nuevo modelo de liquidez en varias blockchains.,Prashant Jha,21 Apr 2022,https://cointelegraph.com/news/dex-aims-to-take-on-uniswap-with-its-concentrated-liquidity-bet
Análisis de Precios,"Análisis de precios al 16/3: BTC, ETH, BNB, XRP, LUNA, SOL, ADA, AVAX, DOT, DOGE","Bitcoin y altcoins seleccionados han superado sus niveles de resistencia inmediatos, lo que indica el comienzo de un repunte de alivio.",Rakesh Upadhyay,16 Mar 2022,https://cointelegraph.com/news/price-analysis-3-16-btc-eth-bnb-xrp-luna-sol-ada-avax-dot-doge
Altcoin en detalle,La integración de mercados NFT y las métricas de las DApps de Solana brillan incluso tras la caída del 20% del precio de SOL,"El precio del SOL borró gran parte de sus recientes ganancias, pero los datos muestran que hay buenas razones para que los inversores sigan siendo alcistas.",Marcel Pechman,11 Apr 2022,https://cointelegraph.com/news/solana-nft-marketplace-integration-and-dapp-metrics-shine-even-after-sol-s-20-drop
Opinión,Reforzar la seguridad digital en el metaverso es fundamental para desbloquear el potencial comercial,"El Metaverso se abrió a nuevos productos, negocios, inversiones y relaciones. Las empresas, los inversores y las instituciones financieras ya están estudiando y realizando simulaciones para comprender los beneficios potenciales que pueden surgir de las actividades en este entorno",Rodrigo Di Paula Ambrissi,25 Nov 2022,https://cointelegraph.com/news/strengthening-digital-security-in-the-metaverse-is-critical-to-unlocking-commercial-potential
Noticias,"Las instituciones ""se están moviendo muy, muy rápido"" hacia las criptomonedas, dice ejecutivo de Coinbase","D'Agostino también dijo que las recientes batallas entre la SEC y la CFTC son algo bueno para las criptomonedas, porque indican que será una ""pieza de vital importancia en la estructura del mercado"" en el futuro",Brayden Lindrea,19 Oct 2022,https://cointelegraph.com/news/institutions-moving-very-very-fast-into-crypto-coinbase-exec
Noticias,Los exchanges coreanos acuerdan un sistema de emergencia en caso de colapso al estilo de Terra,"Los exchanges coreanos pronto tendrán que cotizar los tokens según las mismas directrices para garantizar el cumplimiento de la normativa local, y tomar decisiones de emergencia de forma conjunta para evitar otro fiasco al estilo de Terra.",Brian Newar,16 Jun 2022,https://cointelegraph.com/news/korean-exchanges-agree-on-emergency-system-in-case-of-terra-style-collapse
Noticias,"La plataforma de preguntas y respuestas médicas, Ask The Doctor, presenta una demanda contra Shiba Inu y se involucra en una guerra de palabras en Twitter","La plataforma canadiense quiere sacar a la luz la verdadera identidad de Shytoshi Kusama, que se ofrece como jefe de proyecto de la popular memecoin, Shiba Inu.",Zhiyuan Sun,21 Dec 2021,https://cointelegraph.com/news/medical-q-a-platform-ask-the-doctor-files-lawsuit-against-shiba-inu-engages-war-of-words-on-twitter
Noticias,Interlay publica un nuevo protocolo con el cual pretende desarrollar la autocustodia DeFi de BTC,"El CEO de Interlay considera un hito la publicación del nuevo documento que promueve la autocustodia de Bitcoin en DeFi, resistente al robo y fácil de usar.",Juan Abad,06 Apr 2022,https://cointelegraph.com/news/interlay-publishes-a-new-protocol-with-which-it-intends-to-develop-the-defi-self-custody-of-btc
Opinión,¿Puede un dolár digital ser beneficioso para las criptomonedas?,"Según Nathan Thompson, el principal redactor técnico de Bybit, una moneda digital del banco central (CBDC) de la Reserva Federal, sería una bendición para las criptomonedas y el gobierno estadounidense.",Juan Abad,31 May 2022,https://cointelegraph.com/news/can-a-digital-dollar-be-beneficial-for-cryptocurrencies
Noticias,"Victoria legal de Ripple, fusión de Ethereum se cerca, Rappi aceptando cripto y mucho más. Un resumen de las criptonoticias más importantes de la semana","Victoria legal de Ripple, fusión de Ethereum se cerca, Rappi aceptando cripto y mucho más. Un resumen de las criptonoticias más importantes de la semana junto a Blockchain Summit Latam",Cointelegraph en Español,15 Apr 2022,https://cointelegraph.com/news/ripples-legal-victory-ethereum-merger-nears-rappi-accepting-crypto-and-more
Actualización de mercado,"Estos son los niveles de precios de Bitcoin a vigilar mientras Terra compra 2,500 BTC para casi igualar a Tesla","Las cosas se ven precarias para bitcoin esta semana, ya que la tendencia a la baja de BTC, impulsada por la macroeconomía, continúa.",William Suberg,13 Apr 2022,https://cointelegraph.com/news/bitcoin-price-levels-to-watch-as-terra-buys-2-5k-btc-to-nearly-match-tesla
Noticias,Harmony propone acuñar 4.97 mil millones de tokens para reembolsar a las víctimas,"Según la propuesta, habría un reembolso del 100% a través de 4,970 millones de nuevos tokens ONE o un reembolso del 50% con 2,480 millones de tokens ONE.",Brian Quarmby,27 Jul 2022,https://cointelegraph.com/news/backlash-as-harmony-proposes-minting-4-97b-tokens-to-reimburse-victims
Noticias,"El exchange de criptomonedas canadiense Coinsquare, registrado por el IIROC, sufre una violación de datos","El 19 de noviembre, Coinsquare tuvo que cerrar temporalmente sus operaciones para investigar una actividad inusual en su plataforma.",Arijit Sarkar,26 Nov 2022,https://cointelegraph.com/news/iiroc-registered-canadian-crypto-exchange-coinsquare-suffers-data-breach
Entrevista,"Los NFT serán ""tan disruptivos"" como lo fue Bitcoin hace 10 años, dice un ejecutivo de Kraken","Jonathon Miller, director general del exchange de criptomonedas Kraken en Australia, afirma que, a pesar de la caída de los volúmenes de NFT, la empresa sigue siendo ""alcista en el espacio de NFT"".",Ciaran Lyons,14 Oct 2022,https://cointelegraph.com/news/nfts-will-be-as-disruptive-as-bitcoin-was-10-years-ago-kraken-exec
Actualización de mercado,"Bitcoin realiza un rebote clásico en el nivel de USD 40,700 mientras que el precio de BTC cierra el círculo de enero de 2021","El precio puede ser el mismo, pero el sentimiento difícilmente podría ser más diferente, según muestran los datos.",William Suberg,09 Jan 2022,https://cointelegraph.com/news/bitcoin-performs-classic-bounce-at-40-7k-as-btc-price-comes-full-circle-from-january-2021
Noticias,La HBAR Foundation lanza un fondo metaverso de USD 250 millones para mejorar la adopción de marcas por parte de los consumidores,"Este es el mayor fondo que la fundación ha lanzado hasta la fecha, una declaración de intenciones de su aspiración en la economía tokenizada y el espacio metaverso.",Tom Farren,07 Apr 2022,https://cointelegraph.com/news/hbar-foundation-launch-250m-metaverse-fund-to-enhance-consumer-brand-adoption
Noticias,Sam Bankman-Fried presentó una nueva solicitud de libertad bajo fianza ante el Tribunal Supremo de Bahamas,"Sam Bankman-Fried presentó una nueva solicitud de libertad bajo fianza solo dos días después de que un juez denegara su solicitud anterior, calificando al fundador de FTX de riesgo de fuga.",Jesse Coghlan,16 Dec 2022,https://cointelegraph.com/news/sbf-reportedly-files-new-bail-application-in-the-bahamas-supreme-court
Actualización de mercado,"Bitcoin recupera la apertura anual mientras que un trader dice que alcanzar el nivel de USD 50,000 ""podría ser probable"" la próxima semana","Todo lo que mantiene la acción del precio de Bitcoin de su próximo hito es una nueva caída por debajo de los USD 45,000.",William Suberg,02 Apr 2022,https://cointelegraph.com/news/bitcoin-regains-yearly-open-as-trader-says-50k-next-week-might-be-likely
Noticias,"USD 89 millones entran a fondos de bitcoin a pesar del conflicto que se avecina, pero los flujos de ETH son negativos","CoinShares señaló que, a pesar de ""la debilidad de los precios y el impacto negativo percibido por el inminente conflicto en Europa del Este"", los productos de inversión en activos digitales mostraron entradas por un total de USD 109 millones la semana pasada",Brian Quarmby,23 Feb 2022,https://cointelegraph.com/news/89m-flows-into-bitcoin-funds-despite-looming-conflict-but-eth-funds-are-negative
Opinión,Mejorando las investigaciones sobre los delitos relacionados con criptomonedas en todo el mundo facilitará la adopción,"Es necesario educar mejor a las fuerzas del orden, junto con los reguladores y los responsables políticos, para marcar realmente la diferencia y conseguir una mayor adopción masiva de las criptomonedas.",Mike Welsh,01 May 2022,https://cointelegraph.com/news/making-crypto-conventional-by-improving-crypto-crime-investigations-worldwide
Noticias,Informe: es más probable que la riqueza hecha a sí misma fluya hacia las criptomonedas que el dinero heredado,"El noventa y cuatro por ciento de los criptoempresarios ricos han hecho su riqueza por su cuenta, sugiere un nuevo informe.",Helen Partz,11 Mar 2022,https://cointelegraph.com/news/self-made-wealth-more-likely-to-flow-into-crypto-than-inherited-report
Análisis de Mercado,Así es como un indicador algorítmico anticipó múltiples fases del prolongado repunte de FXS,"Las altcoins pueden recuperarse por una cantidad infinita de razones, pero algunos picos de precios son históricamente más similares que otros.",Beau Linighan,14 Jan 2022,https://cointelegraph.com/news/here-is-how-one-algorithmic-indicator-anticipated-multiple-phases-of-fxs-protracted-rally
Noticias,El crecimiento de Avalanche da origen a los puentes cross-chain de terceros,"Avalanche lanzó su propio puente oficial a Ethereum en 2021, pero ahora un puente cross-chain pretende reducir aún más los costes de las transacciones.",Prashant Jha,17 Feb 2022,https://cointelegraph.com/news/avalanche-growth-sparks-third-party-cross-chain-bridges
Noticias,Binance lanza su primer centro de atención al cliente en Turquía,Datos muestran que Turquía representa más del 7% del acceso a la plataforma principal de Binance a través de navegadores de escritorio.,Ayse Karaman,15 Apr 2022,https://cointelegraph.com/news/binance-launches-its-first-customer-service-center-in-turkey
Noticias,Goldman Sachs está conectando clientes con el Fondo de Ethereum de Galaxy Digital,Goldman y Galaxy Digital se asocian de nuevo para ayudar a los antiguos clientes a tener más acceso a la industria de las criptomonedas,Brian Newar,09 Mar 2022,https://cointelegraph.com/news/goldman-sachs-is-hooking-up-clients-with-galaxy-digital-s-eth-fund
Noticias,Candidato a gobernador de Nueva York pide una moratoria para la minería de prueba de trabajo,Políticos y activistas han puesto a menudo en el punto de mira las operaciones de criptominería en los alrededores de Seneca Lake debido a la presencia de la planta de Greenidge Generation.,Turner Wright,01 Feb 2022,https://cointelegraph.com/news/new-york-gubernatorial-candidate-calls-for-moratorium-on-proof-of-work-mining
Noticias,El Comité de Asuntos Económicos del Reino Unido no está convencido por la perspectiva de una CBDC minorista,"Un nuevo informe destaca la innovación del sector privado y una mayor inclusión financiera con las CBDC, pero plantea preocupaciones sobre la hegemonía descendente del dólar estadounidense.",Tom Farren,13 Jan 2022,https://cointelegraph.com/news/uk-economic-affairs-committee-unconvinced-by-prospect-of-retail-cbdc
Altcoin en detalle,3 razones por las que el precio de Solana (SOL) podría tener un alza adicional en 2022,"El crecimiento constante del ecosistema, la inversión institucional y un mercado de derivados saludable son señales sólidas de que SOL seguirá siendo uno de los principales competidores en 2022.",Marcel Pechman,17 Dec 2021,https://cointelegraph.com/news/3-reasons-why-solana-sol-price-could-see-additional-upside-in-2022
Noticias,"Polygon y Cere network lanzarán la plataforma multimedia Web3, DaVinci",La plataforma DaVinci pretende ofrecer ventajas que van desde los NFT de suscripción y las exposiciones inmersivas de los creadores hasta los eventos digitales y reales de los fans.,Ornella Hernández,14 Feb 2022,https://cointelegraph.com/news/polygon-and-cere-network-to-launch-web3-media-platform-davinci
Newsletter,Crypto Biz: Sam Bankman-Fried pasa un día en los tribunales y Barry Silbert es acusado de saboteo,El fundador de FTX se declaró inocente de todos los cargos penales relacionados con la quiebra del exchange de criptomonedas.,Sam Bourgi,06 Jan 2023,https://cointelegraph.com/news/crypto-biz-sbf-has-his-day-in-court-barry-silbert-accused-of-stalling-over-frozen-funds
Noticias,Presentan en Perú un proyecto de ley sobre operaciones con criptoactivos,En Perú se presentó una iniciativa con el nombre “Proyecto de Ley del Marco de Comercialización de Criptoactivos”,Juan Abad,04 Jan 2022,https://cointelegraph.com/news/bill-on-crypto-asset-transactions-introduced-in-peru
Noticias,Las solicitudes de marca de Gatorade insinúan su incorporación al metaverso,"Si Gatorade entra en el metaverso, podría unirse a una serie de grandes marcas de alimentos y bebidas que exploran ofertas virtuales, como Coca-Cola, McDonald's y Anheuser-Busch.",Turner Wright,03 May 2022,https://cointelegraph.com/news/gatorade-trademark-applications-hint-at-joining-the-metaverse
Noticias,"Los jugadores blockchain aumentan a medida que los usuarios intentan ""almacenar criptomonedas"": DappRadar","Los juegos blockchain aumentaron en usuarios activos en septiembre, mientras que God's Unchained entró en el top 10 en cuanto a volumen total de ventas de NFT de todos los proyectos.",Brian Quarmby,30 Sep 2022,https://cointelegraph.com/news/blockchain-gamers-surge-as-users-attempt-stacking-crypto-says-dappradar
Noticias,VeChain Foundation anunció el lanzamiento de su moneda estable VeUSD,VeChain Foundation anuncia la primera moneda estable de VeChain Thor: VeUSD,Juan Abad,05 Jan 2022,https://cointelegraph.com/news/vechain-foundation-announced-the-launch-of-its-stable-currency-veusd
Noticias,Un grupo de expertos suizo insta a una mayor cooperación mundial en lo que respecta a la regulación de las criptomonedas,El documento destaca que los investigadores que trabajan con criptomonedas deben invertir en el aprendizaje de métodos y tecnologías que estén al día con la evolución de las estrategias de las organizaciones criminales.,Arnold Kirimi,19 May 2022,https://cointelegraph.com/news/swiss-think-tank-urges-greater-global-cooperation-on-crypto-regulation
Análisis,Vuelven las dudas al sentimiento del mercado cripto,"A pesar de haber mostrado una recuperación sólida de la incertidumbre y el miedo de los últimos cuatro meses, el mercado de las criptomonedas aún está lejos de sus máximos históricos.",Juan Abad,08 Apr 2022,https://cointelegraph.com/news/doubts-return-to-crypto-market-sentiment
Noticias,Argentina restringe aún más la compra a divisas extranjeras,Las empresas que aprovecharon el “dólar soja” en Argentina ahora tienen prohíbido comprar dólares,Matías Nahuel Castro,24 Sep 2022,https://cointelegraph.com/news/argentina-further-restricts-foreign-currency-purchases
Noticias,Las réplicas del colapso de FTX habrían provocado el cese de operaciones de Genesis Block en Hong Kong,El exchange de criptomonedas con sede en Hong Kong dice que la agitación del mercado por la caída de FTX es la causa final del cese de las operaciones tras un año de reducción de los servicios.,Savannah Fortis,18 Nov 2022,https://cointelegraph.com/news/ftx-market-aftershock-reportedly-causes-genesis-block-to-cease-trading-in-hong-kong
Actualización de mercado,"El precio de BTC prueba el nivel de USD 17,000 mientras los analistas de Bitcoin observan el CPI y los catalizadores del FOMC","Bitcoin comienza a lidiar con nuevas señales macro de EE. UU., ya que el precio de BTC mantiene constantemente el soporte de USD 17,000.",William Suberg,09 Dec 2022,https://cointelegraph.com/news/btc-price-tests-17k-on-ppi-as-bitcoin-analysts-eye-cpi-fomc-catalysts
Noticias,La empresa minera de BTC Compute North se declara en quiebra,"Compass Mining, socio de Compute North en materia de alojamiento, ha declarado que la empresa seguirá operando con normalidad en esta fase.",Brian Quarmby,23 Sep 2022,https://cointelegraph.com/news/btc-mining-firm-compute-north-files-for-bankruptcy
Noticias,"El comité del Senado de EEUU programa la audiencia de FTX para el 1 de diciembre, el presidente de la CFTC testificará","La audiencia, titulada ""Por qué el Congreso necesita actuar: Lecciones aprendidas del colapso del FTX"", será una de las primeras en las que los legisladores estadounidenses analicen lo ocurrido con el exchange.",Turner Wright,21 Nov 2022,https://cointelegraph.com/news/us-senate-committee-schedules-ftx-hearing-for-dec-1-cftc-head-to-testify
Noticias,Desde Let´sBit destacan que los usuarios pueden ser custodios de su capital al invertir en criptomonedas,"La tecnología está cambiando el concepto de la economía centralizada por gobiernos, bancos centrales y grandes corporaciones",Cointelegraph en Español,26 Jan 2022,https://cointelegraph.com/news/lets-bit-stresses-that-users-can-be-custodians-of-their-capital-when-investing-in-cryptocurrencies
Noticias,Cash App y Chivo han ayudado a que el volumen de pagos de la Lightning Network aumente un 400%,"La solución de escalado de capa 2 de Bitcoin, la Lightning Network, ha visto aumentar su volumen de pagos en más de un 400% a medida que crece la adopción real.",Tom Mitchelhill,14 Apr 2022,https://cointelegraph.com/news/cashapp-and-chivo-help-drive-lightning-payment-volume-up-400
Noticias,El Open de Australia entra en el Metaverso en Decentraland,"Una recreación virtual de Melbourne Park, que incluye la Rod Laver Arena y el Grand Slam Park, estará abierta durante el torneo de la AO.",Keira Wright,17 Jan 2022,https://cointelegraph.com/news/the-australian-open-swings-into-the-metaverse-on-decentraland
Opinión,"Las criptomonedas representan una innovación en pagos, pero su adopción global necesita tiempo para consolidarse",Bitcoin se está convirtiendo en un activo financiero importante y lo mismo está sucediendo con otras criptomonedas,Rodrigo Di Paula Ambrissi,05 Nov 2022,https://cointelegraph.com/news/cryptocurrencies-represent-an-innovation-in-payments-but-their-global-adoption-needs-time-to-consolidate
Noticias,La fundación Celo propone implementar Uniswap V3 en su blockchain nativa,Celo tiene como objetivo promover casos de uso ecológico y reequilibrar su tesorería con tokens respaldados por activos verdes con la ayuda de Uniswap.,Prashant Jha,11 Mar 2022,https://cointelegraph.com/news/celo-foundation-proposes-to-deploy-uniswap-v3-on-its-native-blockchain
Noticias,"El gigante sudafricano de los víveres ""Pick n Pay"" pretende aceptar Bitcoin en todas las tiendas del país",La empresa dijo que permitirá a los clientes pagar con cualquier aplicación habilitada para Lightning Network y códigos QR para agilizar los pagos.,Judith BannermanQuist,02 Nov 2022,https://cointelegraph.com/news/south-african-grocery-giant-pick-n-pay-intends-to-accept-bitcoin-in-all-stores-nationwide
Newsletter,Cointelegraph Consulting: ¿Los NFT musicales son una oportunidad desaprovechada?,"Las ventas de NFT de música en OpenSea han tenido un rendimiento inferior al de las obras de arte digitales, los objetos de colección y otras categorías.",Cointelegraph Consulting,16 Dec 2021,https://cointelegraph.com/news/cointelegraph-consulting-is-nft-music-an-untapped-opportunity
Altcoin en detalle,Dogecoin se dispara un 25% luego de que Musk anunciara los pagos de DOGE para la mercancía de Tesla,La noticia alcista llega meses después de que el multimillonario empresario dijera que DOGE era un token mejor para realizar transacciones que Bitcoin.,Yashu Gola,14 Jan 2022,https://cointelegraph.com/news/dogecoin-leaps-25-after-musk-announces-doge-payments-for-tesla-merch
Noticias,Un tribunal británico autoriza la entrega de una demanda en un NFT,"Las normas de procedimiento civil en el Reino Unido ya permitían que las demandas se notificaran a través de Instagram, Facebook y un formulario de contacto en un sitio web.",Turner Wright,13 Jul 2022,https://cointelegraph.com/news/uk-court-allows-lawsuit-to-be-delivered-via-nft
Noticias,"El presidente del El Salvador, Nayib Bukele, canceló su participación en  la Bitcoin Conference Miami 2022",La situación en El Salvador impide que Nayib Bukele participe en la conferencia que tiene lugar en Miami.,Juan Abad,06 Apr 2022,https://cointelegraph.com/news/the-president-of-el-salvador-nayib-bukele-canceled-his-participation-in-the-bitcoin-conference-miami-2022
Análisis,El Banco Central de Rusia entra en guerra. ¿Es la criptomoneda un amigo o un enemigo?,Los responsables políticos de Moscú se apresuran a replantear su enfoque de la moneda digital como uno de los varios medios para proteger la economía cada vez más aislada.,Travis Jones,17 Mar 2022,https://cointelegraph.com/news/russia-s-central-bank-goes-to-war-is-cryptocurrency-a-friend-or-foe
Noticias,El Fondo Exponencial de Donaciones de EthicHub cumple 4 años multiplicando el impacto,El fondo tiene como objetivo transformar las donaciones que reciben de la campaña en una fuente constante y recurrente de financiación barata a pequeños agricultores desbancarizados,Daniel Jimenez,18 Nov 2022,https://cointelegraph.com/news/the-ethichub-exponential-donation-fund-celebrates-4-years-multiplying-the-impact
Entrevista,Las tecnologías web3 podrían cambiar las reglas del juego en el sector de los viajes,NFTickets podría permitir a las aerolíneas y a los eventos aumentar sus ingresos mediante la reventa en el mercado secundario.,Judith BannermanQuist,23 Sep 2022,https://cointelegraph.com/news/web3-technologies-could-be-a-game-changer-for-the-travel-industry
Noticias,"El acusado de ""banca en la sombra"" Reggie Fowler pide un aplazamiento de la sentencia de 6 meses",La solicitud cita los problemas de salud personales del abogado de Fowler y la necesidad de obtener más material de Europa.,David Attlee,12 Sep 2022,https://cointelegraph.com/news/accused-shadow-banker-reggie-fowler-seeks-a-6-month-sentencing-delay
Noticias,En una provincia Argentina impulsan una stablecoin atada al dólar estadounidense,"En San Luis se ha creado mediante ley un activo digital que fomenta el ahorro, así como también se hacen los incentivos para el uso de tokens no fungibles con las colecciones de arte de la Provincia",Ray Jimenez Bravo,15 Dec 2022,https://cointelegraph.com/news/in-the-argentine-province-of-san-luis-a-law-was-passed-to-authorize-the-creation-of-a-digital-asset-quoted-in-dollars-to-promote-savings
Noticias,La finalización exitosa de la última shadow fork muestra que Ethereum está preparado para The Merge,La finalización exitosa de la última shadow fork indica que la red Ethereum está preparada para migrar a un mecanismo de consenso proof-of-stake,Arijit Sarkar,10 Sep 2022,https://cointelegraph.com/news/ethereum-ready-for-the-merge-as-last-shadow-fork-completes-successfully
