label,title,description,autor,date,url
Noticias,"SundaeSwap se lanza en Cardano, pero los usuarios reportan transacciones fallidas","El primer DEX de Cardano se ha lanzado hoy en la red principal para permitirles a los traders realizar swaps y añadir liquidez, pero la congestión de la red ha ralentizado el procesamiento de las transacciones.",Brian Newar,21 Jan 2022,https://cointelegraph.com/news/sundaeswap-launches-on-cardano-but-users-report-failing-transactions
Análisis de Precios,"Análisis de precios al 8/15: BTC, ETH, BNB, XRP, ADA, SOL, DOGE, DOT, SHIB, AVAX",Bitcoin y las altcoins se encontraron con la venta en los niveles de resistencia clave y los inversores no están seguros de si los traders comprarán la caída actual.,Rakesh Upadhyay,15 Aug 2022,https://cointelegraph.com/news/price-analysis-8-15-btc-eth-bnb-xrp-ada-sol-doge-dot-shib-avax
Noticias,FTX se expande a Europa con la aprobación de la CySEC,"Con sede en Suiza, FTX Europe ofrecerá los productos de FTX en Europa, incluidos los servicios de criptoderivados.",Prashant Jha,07 Mar 2022,https://cointelegraph.com/news/ftx-expands-to-europe-with-cysec-approval
Noticias,"El FOMO será lo que impulse la adopción de las criptomonedas en 2022, asegura la cofundadora de BlockFi","La cofundador de BlockFi espera que la acción de los precios al alza, los nuevos talentos y la claridad normativa crearán una atmósfera de FOMO para la adopción de criptomonedas en 2022.",Joseph Hall,21 Dec 2021,https://cointelegraph.com/news/fomo-will-drive-crypto-adoption-in-2022-says-blockfi-co-founder
Noticias,Los índices de Nansen revelan tendencias reveladoras en el espacio de los NFT,"El análisis revela que el índice NFT-500 durante el periodo comprendido entre el 1 de enero y el 9 de marzo de 2022 aumentó un 68,5% cuando se denominó en ETH, y registró una ganancia del 20,9% cuando se midió en USD.",Tom Farren,15 Mar 2022,https://cointelegraph.com/news/nansen-s-indexes-reveal-insightful-trends-in-the-nft-space
Noticias,La Comisión Nacional de Mercados de Valores española contactará con influencers financieros para demandar algunas aclaraciones,"El presidente de la CNMV, Rodrigo Buenaventura, ya habría  pedido previamente a los influencers responsabilidad a la hora de promover las criptomonedas.",Juan Abad,24 Oct 2022,https://cointelegraph.com/news/the-national-commission-of-securities-markets-goes-for-the-financial-influencer
Noticias,Telegram lanza un mercado para subastar nombres de usuario raros,"La popular aplicación de mensajería ha lanzado un nuevo mercado en la cadena de bloques TON, en el que planea subastar los raros nombres de usuarios.",Savannah Fortis,27 Oct 2022,https://cointelegraph.com/news/telegram-launches-marketplace-to-auction-rare-username-handles
Noticias,Coinbase obtiene la aprobación en principio para la licencia de proveedor de servicios de criptomonedas en Singapur,"El país es un mercado institucional clave para el exchange, según el CEO de Coinbase Singapur, que explicó que también está trabajando con grupos locales del sector para mejorar la normativa.",Jesse Coghlan,11 Oct 2022,https://cointelegraph.com/news/coinbase-gains-in-principle-approval-for-singapore-crypto-license
Análisis,El mercado de criptomonedas cayó ante el informe de inflación de EEUU,"El sentimiento es bajista en todos los mercados, y las economías mundiales han empezado a desacelerar.",Juan Abad,17 Sep 2022,https://cointelegraph.com/news/markets-fall-on-us-inflation-report
Noticias,La quiebra de FTX congela millones en fondos de empresas de criptomonedas,"Galois Capital, New Huo Technology y Nestcoin son algunas de las empresas de criptomonedas con fondos atascados en FTX, ya que el exchange se encuentra en proceso de quiebra en Estados Unidos.",Tom Blackstone,16 Nov 2022,https://cointelegraph.com/news/ftx-bankruptcy-freezes-millions-worth-of-crypto-company-funds
Noticias,La Casa Blanca está preparando una orden ejecutiva sobre las criptomonedas,Se espera que la Administración de Biden emita una orden que haga que las agencias gubernamentales comiencen a realizar análisis de riesgo sobre las criptomonedas como amenaza a la seguridad nacional.,Brian Newar,28 Jan 2022,https://cointelegraph.com/news/white-house-reportedly-preparing-executive-order-on-crypto
Análisis de Precios,"Las 5 criptomonedas que hay que vigilar esta semana: BTC, MATIC, NEAR, ATOM, HNT","Si Bitcoin sube desde su nivel actual, podría impulsar el precio de MATC, NEAR, ATOM y HNT a corto plazo.",Rakesh Upadhyay,27 Dec 2021,https://cointelegraph.com/news/top-5-cryptocurrencies-to-watch-this-week-btc-matic-near-atom-hnt
Análisis de Mercado,"Métrica clave del precio de Ethereum alcanza un mínimo de 6 meses tras la caída de ETH por debajo de los USD 3,000","El precio de ETH ha estado en una tendencia a la baja durante 3 meses, y los datos de los derivados muestran que los traders profesionales están casi listos para tirar la toalla.",Marcel Pechman,21 Jan 2022,https://cointelegraph.com/news/a-key-ethereum-price-metric-hits-a-6-month-low-as-eth-falls-below-3k
Entrevista,Cómo les va a los cajeros automáticos de Bitcoin en Grecia durante una temporada turística que bate récords,"A pesar de las cifras récord de la pasada temporada turística de verano, la criptoescena local en Grecia no ve ningún impacto, dice el cofundador de los cajeros automáticos de bitcoin locales BCash, Dimitrios Tsangalidis.",Savannah Fortis,22 Sep 2022,https://cointelegraph.com/news/how-bitcoin-atms-in-greece-fare-during-a-record-breaking-tourist-season
Noticias,Pixel Vault recauda USD 100 millones para una plataforma de desarrollo de NFT,"El desarrollador detrás de los populares proyectos de NFT, PUNKS Comic y MetaHero Universe, junto con los inversores Velvet Sea Ventures y 01A, planean ser pioneros en la narración de historias en la Web3 a través de su nueva empresa.",Ornella Hernández,02 Feb 2022,https://cointelegraph.com/news/pixel-vault-raises-100m-for-nft-development-platform
Noticias,La filtración de datos de OpenSea provoca una fuga masiva de direcciones de correo electrónico de los usuarios,El mercado de NFT señaló que ha informado del incidente a las fuerzas del orden y que se está llevando a cabo una investigación.,Arnold Kirimi,30 Jun 2022,https://cointelegraph.com/news/opensea-data-breach-causes-massive-leak-of-users-email-addresses
Noticias,"Crypto.com consigue la luz verde en el Reino Unido para realizar ""actividades con criptoactivos""","Según la definición de la FCA, la ""actividad de criptoactivos"" incluye cualquier cosa que implique el intercambio de una criptomoneda por otra o el intercambio de una criptomoneda por fiat y viceversa.",Luke Huigsloot,17 Aug 2022,https://cointelegraph.com/news/crypto-com-secures-uk-registration-for-cryptoasset-activities
Opinión,¿Qué significa la llegada de Elon Musk a Twitter?,"Después de varios meses de drama, ya se realizó la adquisición de Twitter. Elon Musk es el tuitero en jefe. ¡Por fin! ¿Y ahora qué?",Gustavo Godoy,31 Oct 2022,https://cointelegraph.com/news/what-does-the-arrival-of-elon-musk-on-twitter-mean
Noticias del mercado,"DeFi no está muerto, sólo necesita arreglar 3 grandes problemas","Ha sido un año difícil para DeFi, y puede que no mejore hasta que los proyectos se centren más en la seguridad, la regulación y la usabilidad.",Jordan Finneseth,31 May 2022,https://cointelegraph.com/news/defi-isn-t-dead-it-just-needs-to-fix-these-3-critical-problems
Noticias,El mayor operador de telefonía móvil de Japón creará un consorcio de Web3,"Parcialmente propiedad del Estado, NTT Docomo pretende acelerar la adopción de la Web3 en Japón.",David Attlee,08 Nov 2022,https://cointelegraph.com/news/japan-s-largest-mobile-operator-to-establish-web3-consortium
Noticias,"La blockchain Oasys, respaldada por YGG, espera popularizar los juegos P2E","""El juego es el mejor caso de uso que el mundo ha visto para blockchain, y creo que veremos 10 millones de monederos interactuando con juegos blockchain antes de que termine este año"", dijo el miembro fundador de Oasys, Gabby Dizon.",Brian Quarmby,17 Feb 2022,https://cointelegraph.com/news/ygg-backed-oasys-blockchain-hopes-to-take-p2e-gaming-mainstream
Noticias,¿Qué son las Finanzas embebidas? Ejecutivos fintech destacaron puntos a tener en cuenta,Se realizó un debate sobre la importancia de las finanzas embebidas organizado por la Cámara Argentina de Fintech,Pedro Q. Justicia,20 Sep 2022,https://cointelegraph.com/news/what-is-embedded-finance-fintech-executives-highlighted-points-to-keep-in-mind
Noticias,Las Bahamas se asesoran mientras el caso FTX sigue su curso en los tribunales de EE.UU. y se enconan los desacuerdos,"Brown Rudnick trabaja para el país desde marzo, pero el papel potencialmente creciente de la nación en el caso exige que se registre en Estados Unidos como agente extranjero.",Derek Andersen,03 Jan 2023,https://cointelegraph.com/news/the-bahamas-lawyers-up-as-the-ftx-case-proceeds-in-us-court-and-disagreements-fester
Noticias,La App Store de Apple quiere un recorte del 30% en las ventas de NFT,"Aunque la comisión es habitual para Apple, algunos han expresado su descontento por el recorte ""grotescamente sobrevalorado"" de las ventas por parte de la compañía.",Jesse Coghlan,26 Sep 2022,https://cointelegraph.com/news/grotesquely-overpriced-apple-s-app-store-wants-30-cut-on-nft-sales
Altcoin en detalle,El precio de MATIC apunta a un aumento del 200% en la adopción de Polygon por parte de Instagram y JPMorgan,"La lista de socios de alto perfil de Polygon es cada vez más larga, con Disney, Starbucks y Robinhood ya formando parte de su blockchain.",Yashu Gola,03 Nov 2022,https://cointelegraph.com/news/matic-price-eyes-200-gains-on-polygon-adoption-by-instagram-jpmorgan
Noticias,"El gobernador de la Fed, Christopher Waller, dice que una CBDC de EE.UU. no mejoraría las cosas que el mundo ama de la moneda fiduciaria de EE.UU.","Estados Unidos y el mundo se benefician de la primacía del dólar estadounidense en la economía mundial, pero es una stablecoin, y no una CDBC, lo que potenciará el lugar del fiat, según Waller.",Derek Andersen,15 Oct 2022,https://cointelegraph.com/news/fed-governor-waller-says-us-cbdc-would-not-enhance-things-the-world-loves-about-us-fiat
Noticias,El uso de efectivo aún registra un número fuerte entre los españoles,"De acuerdo a la plataforma Denaria, el uso del efectivo mantiene la senda de recuperación iniciada tras la pandemia, y desmiente los presagios de su desaparición.",Juan Abad,04 Jan 2023,https://cointelegraph.com/news/the-use-of-cash-still-registers-a-strong-number-among-spaniards
Investigación,La pesadilla de junio adquiere un nuevo significado en otro mes a la baja de 2022,"Las direcciones gestionadas principalmente por traders humanos activos han superado las 147,000 direcciones por primera vez desde noviembre.",Cointelegraph Consulting,01 Jul 2022,https://cointelegraph.com/news/june-gloom-takes-on-a-new-meaning-in-another-2022-down-month
Análisis de Mercado,"Los hodlers de bitcoin acumulan la cifra récord de 8 millones de BTC en pérdidas no realizadas, según los datos","La cantidad de bitcoin retenida ""bajo el agua"" en los monederos sigue aumentando, alcanzando niveles nunca vistos en la historia.",William Suberg,27 Dec 2022,https://cointelegraph.com/news/bitcoin-hodlers-sit-on-record-8m-btc-in-unrealized-loss-data-shows
Video,Contratos inteligentes de Bitcoin vs. Ethereum - Entrevista con Muneeb Ali: Market Talks,"Únete a nosotros y discute las ventajas de construir sobre Bitcoin con Muneeb Ali y nuestro anfitrión, Giovanni Pigni.",Cointelegraph,20 Oct 2022,https://cointelegraph.com/news/bitcoin-vs-ethereum-smart-contracts-interview-with-muneeb-ali-watch-market-talks
Noticias,"San Lorenzo, un club argentino de Fútbol, llegó a un acuerdo con la firma europea Shirtum",Shirtum realizó un acuerdo con el club San Lorenzo de Argentina para crear un museo digital con NFTs,Pedro Q. Justicia,15 Sep 2022,https://cointelegraph.com/news/san-lorenzo-an-argentinean-soccer-club-reached-an-agreement-with-the-european-firm-shirtum
Análisis,Perú es el país que recibe más ciberataques según un reporte de ESET,"Perú es el país con más detecciones maliciosas con un total de 18%, le sigue México inmediatamente con el 17%, Colombia 12%, Argentina 11% y Ecuador con el 9%.",Ray Jimenez Bravo,20 Dec 2022,https://cointelegraph.com/news/peru-is-the-country-with-the-most-cyberattacks-according-to-an-eset-report
Noticias,¿Cuáles son los objetivos a largo plazo para la blockchain de Ethereum? Vitalik Buterin lo explica en vivo en EthCC,"Para Buterin, la construcción de un mejor ecosistema descentralizado requiere un dolor a corto plazo para un beneficio a largo plazo.",Zhiyuan Sun,21 Jul 2022,https://cointelegraph.com/news/what-are-the-long-terms-goals-for-the-ethereum-blockchain-vitalik-buterin-explains-live-at-ethcc
Noticias,"El regulador financiero de Alemania ordena a Coinbase que solucione sus prácticas de ""organización empresarial""","En vigor desde el 27 de octubre, la orden de BaFin se refería a que la subcontratación de filial alemana de Coinbase de algunas operaciones eran ""esenciales para llevar a cabo la actividad bancaria o prestar servicios financieros"".",Turner Wright,08 Nov 2022,https://cointelegraph.com/news/germany-s-financial-regulator-orders-coinbase-to-address-business-organization-practices
Actualización de mercado,Un analista de Bitcoin identifica nuevos niveles clave mientras el precio de Ethereum se acerca a un máximo de 3 semanas,"Los nuevos niveles de soporte y resistencia de Bitcoin se cristalizan en medio de un rango de negociación ""extremadamente estrecho"", mientras que la acción del precio de ETH establece máximos de varias semanas.",William Suberg,04 Jan 2023,https://cointelegraph.com/news/bitcoin-analyst-reveals-new-key-levels-as-ethereum-price-nears-3-week-high
Análisis,¿Qué tan real es que en DeFi se use un nuevo mecanismo para lavar dinero?,La base de los delitos que hay con criptoactivos es el lavado de dinero,Eloisa Cadenas,22 Sep 2022,https://cointelegraph.com/news/how-real-is-defis-use-of-a-new-money-laundering-mechanism
Noticias,La SEC recibe la orden judicial de entregar los documentos de Hinman a Ripple Labs tras meses de negativa,"La jueza del Distrito de Estados Unidos, Analisa Torres, anuló el segundo intento de la SEC de retener los documentos relacionados con el director de la división, William Hinman, quien dijo que Bitcoin y Ether no son valores.",Derek Andersen,30 Sep 2022,https://cointelegraph.com/news/judge-orders-sec-to-turn-hinman-documents-over-to-ripple-labs-after-months-of-dispute
Entrevista,"Los patrocinios deportivos están ayudando a legitimar las criptomonedas en Australia, dice un ejecutivo de Coinjar","Luke Ryan, de CoinJar, dice que las asociaciones deportivas ""ayudan a cambiar la idea de que las criptomonedas solo existen como manía especulativa"".",Jesse Coghlan,19 Sep 2022,https://cointelegraph.com/news/sports-sponsorship-is-helping-legitimize-crypto-in-australia-coinjar-exec
Actualización de mercado,"Un trader señala los niveles de precios de Bitcoin que hay que vigilar, mientras BTC aún corre el riesgo de alcanzar un ""suelo definitivo"" de USD 30,000","Mucho depende de que el dólar estadounidense se detenga rápidamente, dice Michaël van de Poppe, y el potencial alcista del Bitcoin sigue siendo impresionante.",William Suberg,27 Apr 2022,https://cointelegraph.com/news/trader-flags-btc-price-levels-to-watch-as-bitcoin-still-risks-30k-ultimate-bottom
Newsletter,"Nifty Newsletter, 24-30 de agosto: Meta dice que los usuarios de FB e IG pueden publicar NFT",El volumen de operaciones del mercado NFT OpenSea ha pasado de USD 405 millones el 1 de mayo a 5 millones el 28 de agosto.,Ezra Reguerra,31 Aug 2022,https://cointelegraph.com/news/meta-says-fb-and-ig-users-can-post-nfts-nifty-newsletter-aug-24-30
Análisis de Mercado,"El fractal ""marzo 2020"" de Ethereum apunta a un mínimo en el precio, pero los bajistas de ETH predicen un desplome del 50%","Los analistas del mercado Ethereum buscan desesperadamente el fondo, pero los precios técnicos de ETH no excluyen más caídas por debajo de USD 700.",Yashu Gola,06 Dec 2022,https://cointelegraph.com/news/ethereum-march-2020-fractal-hints-at-price-bottom-but-eth-bears-predict-50-crash
Noticias,La participación de FTX en un banco de EEUU suscita preocupación por irregularidades bancarias,"El presidente del banco rural, Jean Chalopin, también es el presidente de Deltec Bank, que tiene a Tether y Alameda en su lista de clientes.",Prashant Jha,25 Nov 2022,https://cointelegraph.com/news/ftx-stake-in-us-bank-raises-concerns-about-banking-loopholes
Opinión,Cómo empezar a invertir en DeFi y evitar las estafas,Las “banderas rojas” que hay que ver antes de invertir en un proyecto DeFi,Matías Nahuel Castro,05 Apr 2022,https://cointelegraph.com/news/how-to-start-investing-in-defi-and-avoid-scams
Opinión,El dólar perdió el 95% del poder de compra frente al Bitcoin en los últimos 5 años,Precio de Bitcoin sigue consolidándose históricamente frente al dólar a pesar del fuerte retroceso ocurrido este fin de semana en el principal activo de referencia del criptomercado.,Daniel Jimenez,09 May 2022,https://cointelegraph.com/news/the-dollar-lost-95-of-the-purchasing-power-against-bitcoin-in-the-last-5-years
Análisis de Mercado,"¿Por qué el precio de Bitcoin está cayendo por debajo de USD 24,000?","El CEO de Trading Different, compartió con Cointelegraph en Español un análisis al respecto del precio de BTC",Cointelegraph en Español,13 Jun 2022,https://cointelegraph.com/news/why-is-the-bitcoin-price-falling-below-24-000
Noticias,"Nasdaq advierte a la empresa minera de Bitcoin, Bitfarms, sobre la deficiencia en el precio de las acciones",Bitfarms tiene un plazo inicial de 180 días naturales para que sus acciones coticen por encima de USD 1 durante al menos 10 días antes del 12 de junio de 2023.,Helen Partz,14 Dec 2022,https://cointelegraph.com/news/nasdaq-warns-bitcoin-mining-firm-bitfarms-about-share-price-deficiency
Noticias de Última Hora,Último minuto: Grayscale toma medidas legales tras el rechazo de su ETF al contado de Bitcoin,"El miércoles también se tomó una decisión similar en relación con el producto cotizado en bolsa (ETP) de Bitwise, citando las mismas razones.",Felix Ng,30 Jun 2022,https://cointelegraph.com/news/breaking-grayscale-launches-legal-challenge-to-bitcoin-spot-etf-rejection
Noticias,Los Emiratos Árabes Unidos estarían planeando emitir una licencia federal cripto para los VASP,"La legislación de licencias cripto podría ser la primera regulación nacional centrada en las criptomonedas. Sin embargo, varias zonas francas del país introdujeron regulaciones cripto desde 2018.",Prashant Jha,17 Feb 2022,https://cointelegraph.com/news/uae-reportedly-plans-to-issue-federal-crypto-license-for-vasps
Noticias,"Un asesor de Ripple anuncia que habrá ""más anuncios sobre CBDC en las próximas semanas""",La compañía de blockchain ha estado presionando fuertemente en el espacio de CBDC desde el pilotaje de su CBDC Private Ledger dirigido a los bancos centrales en marzo de 2021.,Felix Ng,07 Sep 2022,https://cointelegraph.com/news/ripple-advisor-teases-more-cbdc-announcements-in-the-next-few-weeks
Noticias,"""El tiempo no está de nuestra parte"" para dar claridad regulatoria a las criptomonedas, dice un legislador estadounidense","""Tenemos que movernos, elegir un regulador y dar al mercado la seguridad y los límites que se merece"", dijo Josh Gottheimer, miembro de la Cámara de Representantes.",Turner Wright,27 Sep 2022,https://cointelegraph.com/news/time-is-not-on-our-side-to-provide-regulatory-clarity-on-crypto-says-us-lawmaker
Opinión,Las finanzas descentralizadas (DeFi) como un nuevo acelerador de la globalización,Las finanzas descentralizadas brindan las herramientas de libertad financiera necesarias para los nómadas digitales en un mundo con rígidas fronteras.,Katya Shabanova,13 Mar 2022,https://cointelegraph.com/news/decentralized-finance-as-a-new-globalization-accelerator
Noticias,La MAS no se fía de las inversiones minoristas en criptomonedas y está considerando más regulaciones,Los reguladores de Singapur dicen que las criptomonedas son problemáticas debido a la alta volatilidad del mercado y advierten contra las inversiones minoristas.,Savannah Fortis,29 Aug 2022,https://cointelegraph.com/news/mas-doesn-t-trust-retail-crypto-investments-mulling-more-regulations
Análisis,La gráfica de Bitcoin da buenas señales,"El precio de Bitcoin podría subir hasta los 28,000 USD, solo de darse una condición en el análisis técnico.",Juan Abad,12 Aug 2022,https://cointelegraph.com/news/bitcoin-chart-gives-good-signs
Noticias,El Tesoro australiano consulta al público sobre la exclusión fiscal de bitcoin en moneda extranjera,El público dispone de 25 días para compartir su opinión sobre la legislación propuesta.,Arijit Sarkar,06 Sep 2022,https://cointelegraph.com/news/australian-treasury-consults-public-on-bitcoin-foreign-currency-tax-exclusion
Entrevista,"GameFi y las criptomonedas ""encajan naturalmente"" para los editores de juegos: KBW 2022","Los expertos coreanos creen que las criptomonedas desempeñarán un papel importante en el ecosistema de los juegos, y en los próximos tres años, la mayoría de los juegos podrían tener economías in-game basadas en criptomonedas.",Prashant Jha,09 Aug 2022,https://cointelegraph.com/news/gamefi-and-crypto-natural-fit-for-game-publishers-kbw-2022
Noticias,Fondo de inversión tokenizado en España deja impresiones positivas después de su periodo de prueba,"El proyecto confirma múltiples ventajas de la tokenización para inversores, gestoras y fondos de inversión.",Juan Abad,28 Sep 2022,https://cointelegraph.com/news/impressions-about-the-tokenized-investment-fund-in-spain-are-positive-after-its-trial-period
Noticias,Binance delega 13.2 millones de tokens UNI para convirtirse en el segundo mayor votante de Uniswap DAO,"Esta medida permitirá a Binance proponer votaciones de gobernanza, pero no es suficiente para cumplir el requisito de quórum del 4%.",Ana Paula Pereira,19 Oct 2022,https://cointelegraph.com/news/binance-delegates-13-2m-uni-tokens-becoming-uniswap-dao-s-second-largest-vote-holder
Análisis de Precios,"Análisis de precios del 27 de junio: BTC, ETH, BNB, XRP, ADA, SOL, DOGE, DOT, SHIB, AVAX","Bitcoin y las altcoins se enfrentan a la toma de beneficios tras el reciente rally de alivio, pero los gráficos sugieren que se podría volver a los recientes mínimos de oscilación.",Rakesh Upadhyay,27 Jun 2022,https://cointelegraph.com/news/price-analysis-6-27-btc-eth-bnb-xrp-ada-sol-doge-dot-shib-avax
Noticias,El elegido por Biden para la vicepresidencia de la Reserva Federal para la supervisión pide al Congreso que actúe sobre las monedas estables,"El candidato a la Reserva Federal, Michael Barr, dijo que la posibilidad de que la agencia gubernamental lance una moneda digital del banco central es un tema que requiere ""mucha más reflexión y estudio"".",Turner Wright,20 May 2022,https://cointelegraph.com/news/biden-s-pick-for-fed-vice-chair-for-supervision-calls-for-congressional-action-on-stablecoins
Noticias,Binance U.S. hace que el comercio de BTC sea libre de comisiones,El CEO de Binance.US dijo que las tarifas de comercio cero generarían un sentimiento positivo de los usuarios y afirmó que hay planes para ampliar la lista de tokens que ofrecerán comercio de tarifa cero en el futuro.,Felix Ng,23 Jun 2022,https://cointelegraph.com/news/binance-u-s-makes-btc-trading-fee-free-as-competitors-feel-the-heat
Noticias,Los logotipos y material promocional de FTX siguen por todas partes a pesar del procedimiento de quiebra,"Aunque algunos funcionarios han eliminado todo rastro de sus acuerdos con FTX, la marca de la empresa sigue apareciendo en algunos recintos deportivos y en la mercancía.",Turner Wright,28 Nov 2022,https://cointelegraph.com/news/ftx-logos-and-promotional-material-still-everywhere-despite-bankruptcy-proceedings
Noticias,"Vitalik Buterin comparte su ""entusiasmo"" por el futuro de Ethereum",Buterin se mostró especialmente optimista sobre el auge de las identidades descentralizadas basadas en blockchain para mejorar la privacidad de los usuarios.,Zhiyuan Sun,05 Dec 2022,https://cointelegraph.com/news/vitalik-buterin-discusses-his-excitement-for-the-future-of-ethereum
Noticias,La plataforma de criptomonedas Paxful elimina ETH de su mercado,"El CEO de Paxful, Ray Youssef, destaca el cambio de Ethereum a proof-of-stake, la centralización percibida y la capacidad de acuñar tokens como razones para el cambio.",Gareth Jenkinson,21 Dec 2022,https://cointelegraph.com/news/crypto-platform-paxful-removes-eth-from-its-marketplace
Opinión,¿Cómo podrían las granjas de animales aprovechar la minería de Bitcoin?,¿Podría la industria energética del biogás beneficiarse mediante la minería del Bitcoin?,César Patiño Burgos,07 Apr 2022,https://cointelegraph.com/news/how-could-animal-farms-take-advantage-of-bitcoin-mining
Noticias,Sudáfrica finaliza el PoC técnico del sistema de liquidación de CBDC al por mayor,El Banco de la Reserva de Sudáfrica declaró que se emprenderían nuevos trabajos para estudiar las conclusiones del proyecto y que se utilizarían para fundamentar las respuestas políticas y normativas a la DLT y las CBDC.,Jesse Coghlan,08 Apr 2022,https://cointelegraph.com/news/south-africa-finishes-technical-poc-for-wholesale-cbdc-settlement-system
