label,title,description,autor,date,url
Análisis de Mercado,¿Es absurdo esperar una subida masiva del precio de Ethereum antes y después de la fusión?,"El mercado invertido en los futuros de Ethereum muestra que los traders esperan que el ETH suba y que todo el mundo quiere las monedas ""gratuitas"" del hardfork, pero los inversores también deberían vigilar a los bajistas.",Marcel Pechman,11 Aug 2022,https://cointelegraph.com/news/is-it-foolish-to-expect-a-massive-ethereum-price-surge-pre-and-post-merge
Noticias,Agencia de investigación del Congreso de EE.UU. se pronuncia sobre el desplome de UST y señala lagunas en la normativa,"El CRS describió la caída de TerraUSD como un escenario ""similar a una corrida bancaria"" en el que los holders comenzaron a dudar de las reservas que respaldan la paridad con el dólar.",Ezra Reguerra,17 May 2022,https://cointelegraph.com/news/us-congress-research-agency-weighs-in-on-ust-crash-notes-gaps-in-regulation
Noticias del mercado,Bitcoin cotiza ahora más por debajo que nunca de esta línea de tendencia clave,El precio de BTC está ahora más por debajo de su media móvil de 200 semanas que en cualquier otro momento de su historia.,William Suberg,04 Jan 2023,https://cointelegraph.com/news/16-8k-bitcoin-now-trades-further-below-this-key-trendline-than-ever
Actualización de mercado,"El precio de bitcoin no logró superar el nivel de USD 29,000","El analista Dylan LeClair describió la situación como ""inquietantemente tranquila"", basándose en los datos de la volatilidad.",William Suberg,26 May 2022,https://cointelegraph.com/news/btc-price-breakout-due-relatively-soon-as-bitcoin-volumes-spook-traders
Noticias,La estrella brasileña de la UFC recibirá las ganancias de sus peleas en BTC,El luchador de la UFC Matheus Nicolau comenzará a recibir pagos en Bitcoin para protegerse de la inflación y asegurar el valor de su duro trabajo.,Helen Partz,22 Mar 2022,https://cointelegraph.com/news/fight-for-bitcoin-brazilian-ufc-star-to-receive-fight-earnings-in-btc
Noticias,"Las acciones de la minera de Bitcoin, Core Scientific, se disparan un 200%","Tras una ola de malas noticias a lo largo de 2022, a la minera se le ha ofrecido un salvavidas que podría permitirle ver pasar el actual mercado bajista.",Luke Huigsloot,16 Dec 2022,https://cointelegraph.com/news/stock-price-for-troubled-bitcoin-miner-core-scientific-surges-200
Entrevista,Un ejecutivo del sector explica por qué la protección contra el fraude con NFT recae en la marca y no en los mercados,"Las marcas que emiten NFT deberían tener la máxima responsabilidad de protegerse a sí mismas y a los posibles inversores del fraude, sugirió un ejecutivo de seguridad de NFT.",Helen Partz,14 Oct 2022,https://cointelegraph.com/news/industry-exec-explains-why-nft-fraud-protection-falls-on-brand-and-not-marketplaces
Newsletter,"FTX está acabado: ¿qué es lo siguiente para Bitcoin, las altcoins y las criptomonedas en general?","FTX ha desaparecido, y parece que muchas plataformas de criptomonedas centralizadas caerán con él. Pero, ¿hay algún resquicio de esperanza?",Big Smokey,18 Nov 2022,https://cointelegraph.com/news/ftx-is-done-what-s-next-for-bitcoin-altcoins-and-crypto-in-general
Entrevista,"Una escultora pretende utilizar la estatua ""Fearless Girl"" para empoderar a las mujeres en el espacio de las criptomonedas","La escultora, Kristen Visbal, dijo que los ingresos de la venta de Fearless Girl (la Chica Sin Miedo) se utilizarán para defender el mensaje original de la obra.",Ezra Reguerra,11 May 2022,https://cointelegraph.com/news/sculptor-aims-to-use-the-fearless-girl-statue-to-empower-women-in-crypto
Noticias,Los legisladores estadounidenses y el presidente de la Fed instan a la regulación de las criptomonedas tras las sanciones a Rusia,"Jerome Powell dijo que la situación con Rusia ""resalta la necesidad de una acción realmente congresual sobre las finanzas digitales, incluidas las criptomonedas"".",Turner Wright,02 Mar 2022,https://cointelegraph.com/news/us-lawmakers-and-fed-chair-push-for-crypto-regulation-in-wake-of-russia-sanctions
Análisis de Mercado,"El precio de Bitcoin rompió al alza, pero ¿dónde están todos los traders apalancados en ""long""?","El precio del BTC parece romper su tendencia a la baja, pero los traders profesionales siguen sin querer añadir posiciones apalancadas.",Marcel Pechman,01 Jun 2022,https://cointelegraph.com/news/bitcoin-price-broke-to-the-upside-but-where-are-all-the-leveraged-long-traders
Noticias,El Club de Regatas Vasco da Gama cierra una asociación con MetaSoccer para crear un equipo con licencia oficial en el Metaverso,Una empresa española se asocia con el club brasileño para desarrollar todo tipo de productos para el metaverso,César Patiño Burgos,30 Mar 2022,https://cointelegraph.com/news/vasco-da-gama-regatta-club-closes-partnership-with-metasoccer-to-create-an-officially-licensed-team-in-the-metaverse
Altcoin en detalle,El lanzamiento de la stablecoin fUSD y los rumores del regreso de Andre Cronje hacen subir el precio de Fantom (FTM),El precio de FTM se recupera desde su mínimo del 12 de mayo tras el lanzamiento de la stablecoin fUSD y el posible regreso de Andre Cronje.,Jordan Finneseth,23 May 2022,https://cointelegraph.com/news/fusd-stablecoin-launch-and-rumors-of-cronje-s-return-send-fantom-ftm-price-higher
Noticias del mercado,Puede que este sea el peor agosto desde 2015 para bitcoin mientras que los hodlers se preparan para un septiembre bajista,"Las perspectivas de los plazos mensuales son muy frías, ya que septiembre es históricamente un mes ""de números rojos"".",William Suberg,28 Aug 2022,https://cointelegraph.com/news/bitcoin-risks-worst-august-since-2015-as-hodlers-brace-for-septembear
Noticias,El principal banco de Venezuela activó la compra de divisas extranjeras desde su aplicación móvil,Cada vez aumentan más las transacciones con dólares en Venezuela y su principal banco activó ahora la  compra de divisas extranjeras desde su aplicación móvil,Juan Abad,31 Dec 2021,https://cointelegraph.com/news/venezuelas-main-bank-activated-the-purchase-of-foreign-currency-from-its-mobile-application
Noticias,Congresistas estadounidenses indican a la SEC que redefinir conceptos de larga data sería perjudicial para el ecosistema digital,Los miembros republicanos del Comité de Servicios Financieros de la Cámara de Representantes se oponen a los cambios propuestos en la Ley de Intercambio de 1934 en una carta dirigida a la Comisión de Valores.,Derek Andersen,18 Apr 2022,https://cointelegraph.com/news/congressmen-tell-sec-redefining-long-standing-concepts-would-be-bad-for-digital-ecosystem
Análisis de Mercado,"La teoría de la Onda de Elliott sugiere que el precio de Bitcoin puede caer a USD 25,500 este año","La perspectiva bajista de la teoría de la Onda de Elliot apareció cuando Bitcoin cayó por debajo de los USD 35,000.",Yashu Gola,24 Feb 2022,https://cointelegraph.com/news/bitcoin-elliott-wave-theory-suggests-btc-price-can-drop-to-25-5k-this-year
Altcoin en detalle,Las criptomonedas respaldadas por oro brillan en 2022: su capitalización de mercado alcanza los mil millones de dólares por primera vez,"PAX Gold ha sido la que más ha contribuido a que la capitalización del mercado de tokens de oro rebase el hito de los mil millones de dólares, superando a Tether Gold.",Yashu Gola,10 Mar 2022,https://cointelegraph.com/news/gold-backed-cryptos-are-shining-in-2022-market-cap-hits-1b-for-the-first-time
Noticias,Tesla lanza un nuevo cibersilbato que solo se puede comprar con Dogecoin,"""¡Sopla el silbato! Pero hay que pagar en Doge"", dice el CEO de Tesla, Elon Musk.",Zhiyuan Sun,14 Sep 2022,https://cointelegraph.com/news/tesla-launches-new-cyberwhistle-that-can-only-be-bought-using-dogecoin
Recapitulación de evento,Bitcoin 2022 Miami: Resumen de la conferencia y principales temáticas,"El evento, de cuatro días de duración, reunió a desarrolladores, líderes empresariales, responsables políticos y constructores de la economía Bitcoin.",Ornella Hernández,14 Apr 2022,https://cointelegraph.com/news/bitcoin-2022-miami-conference-recap-and-major-themes
Noticias,"Un fallo en el mercado de NFT resta valor a los tokens y ayuda a un explotador a hacerse con USD 750,000","Al parecer, el 31 de diciembre se descubrió el fallo del mercado de NFT, que mostraba los NFT transferidos como listados en OpenSea.",Prashant Jha,24 Jan 2022,https://cointelegraph.com/news/nft-marketplace-bug-undervalues-tokens-helps-exploiter-nab-750-000
Noticias,"La plataforma de arte digital Agora Awards cierra una ronda de inversión de 2,2 millones de euros","La startup española Agora Awards, una plataforma dedicada de arte digital ha cerrado una ronda de financiación que ha logrado recaudar más de dos millones de euros.",Daniel Jimenez,12 Apr 2022,https://cointelegraph.com/news/the-agora-awards-digital-art-platform-closes-an-investment-round-of-22-million-euros
Altcoin en detalle,El precio de Immutable X (IMX) se dispara tras la asociación con GameStop y el lanzamiento de nuevos proyectos,Un puñado de proyectos recién lanzados y el anuncio de la asociación con GameStop del 3 de febrero catalizaron un fuerte repunte del precio de IMX.,Jordan Finneseth,03 Feb 2022,https://cointelegraph.com/news/immutable-x-imx-price-soars-after-gamestop-partnership-and-new-project-launches
Noticias,Informe: el 74% de los fondos robados de los ataques de ransomware fueron a direcciones de billetera afiliadas a Rusia en 2021,Los hackers rusos supuestamente obtuvieron una ganancia de más de USD 400 millones a través del ransomware cripto en 2021.,Zhiyuan Sun,14 Feb 2022,https://cointelegraph.com/news/report-74-of-stolen-funds-from-ransomware-attacks-went-to-russian-affiliated-wallet-addresses-in-2021
Noticias,"Las criptomonedas son más populares que los fondos mutuos entre los millennials, muestra una encuesta","El informe ""Cómo ven los millennials su futuro financiero"" revela que el 40% de los participantes de la encuesta millennial ha invertido en criptomonedas.",Ezra Reguerra,28 Jun 2022,https://cointelegraph.com/news/crypto-more-popular-among-millennials-than-mutual-funds-survey-shows
Noticias,Decenas de clientes de Celsius piden a un tribunal de EEUU recuperar USD 22.5 millones en criptomonedas,"La suspensión de los retiros en custodia de Celsius contradice el lenguaje llano de las condiciones de uso de la empresa, argumentó un grupo de acreedores descontentos.",Helen Partz,01 Sep 2022,https://cointelegraph.com/news/tens-of-celsius-clients-ask-us-court-to-recover-22-5m-in-crypto
Noticias,"EE.UU. necesita ""tokens electrónicos"" con la funcionalidad del dinero en efectivo, según la directora legal del Software Freedom Law Center","La directora legal del Software Freedom Law Center, Mishi Choudhary, apoyó los tokens que no eran exactamente CBDCs ni criptomonedas, pero con características de privacidad similares a las del dinero en efectivo que muchos usuarios podrían desear.",Turner Wright,29 Apr 2022,https://cointelegraph.com/news/us-needs-electronic-tokens-with-functionality-of-cash-software-freedom-law-center-legal-director
Noticias del mercado,"Datos apuntan a un fondo para Bitcoin, pero una métrica advierte de una caída final hasta los USD 14,000","El mercado bajista está lejos de terminar, pero según Glassnode, varias métricas sugieren que la capitulación de Bitcoin ya se ha producido.",Jordan Finneseth,19 Jul 2022,https://cointelegraph.com/news/data-points-to-a-bitcoin-bottom-but-one-metric-warns-of-a-final-drop-to-14k
Análisis de Precios,"Análisis de precios del 17 de agosto: BTC, ETH, BNB, XRP, ADA, SOL, DOGE, DOT, SHIB, AVAX","Los mercados de criptomonedas y de acciones corrigieron a medida que los traders se pusieron nerviosos antes de las actas del FOMC del miércoles, pero el verdadero punto de tensión es si los traders ""comprarán la caída"".",Rakesh Upadhyay,17 Aug 2022,https://cointelegraph.com/news/price-analysis-8-17-btc-eth-bnb-xrp-ada-sol-doge-dot-shib-avax
Noticias,Informe: El Consejo insta al Banco de Estados de África Central a introducir una moneda digital común,"La República Centroafricana, una de las naciones atendidas por el Banco de los Estados de África Central, aprobó en abril una ley que adopta el Bitcoin como moneda de curso legal.",Turner Wright,22 Jul 2022,https://cointelegraph.com/news/board-urges-bank-of-central-african-states-to-introduce-common-digital-currency-report
Noticias,Binance se incorpora a una asociación para abordar el cumplimiento de las sanciones mundiales,El exchange de criptomonedas ha sido objeto de escrutinio por parte de los responsables políticos en medio de las sanciones multilaterales a Rusia y las sanciones estadounidenses a Irán.,Turner Wright,06 Jan 2023,https://cointelegraph.com/news/binance-joins-association-to-address-compliance-with-global-sanctions
Entrevista,El cofundador de Anchorage les dice a los reguladores estadounidenses que lo que la empresa quiere es claridad,"Hay ""15 reguladores diferentes"" y ""básicamente no hay claridad"" en lo que respecta a la regulación de las criptomonedas en Estados Unidos, según Diogo Mónica.",Jesse Coghlan,07 Oct 2022,https://cointelegraph.com/news/anchorage-co-founder-to-us-regulators-what-we-want-is-clarity
Noticias,"Huobi gana una licencia en las Islas Vírgenes Británicas, pero aún no hay planes definidos para el Reino Unido",Huobi posiciona a su filial Brtuomi Worldwide como una de los primeros exchanges en ofrecer servicios de trading y derivados de criptomonedas que cumplen con la normativa en el territorio británico de ultramar.,Helen Partz,09 Sep 2022,https://cointelegraph.com/news/huobi-wins-license-in-the-british-virgin-islands-no-timeline-for-the-uk-yet
Noticias,Vitalik Buterin dice presente en show de Soda Stereo coincidiendo con el lanzamiento de una colección de NFT en Ethereum de la banda,El creador de la criptomoneda Ethereum Vitalik Buterin se presentó en Buenos Aires en el Show de Soda Stereo.,Daniel Jimenez,21 Dec 2021,https://cointelegraph.com/news/vitalik-buterin-is-present-at-the-soda-stereo-show-coinciding-with-the-launch-of-an-nft-collection-in-ethereum-of-the-band
Noticias,Lanzan nueva colección de NFT en España,"El nuevo NFT “Smirriau NFT”, está soportada en la red blockchain de Ethereum, y posee 5,000 diseños únicos. 721 de estos, se encuentran en acuñación, por ahora.",Daniel Jimenez,27 Dec 2021,https://cointelegraph.com/news/new-nft-collection-is-launched-in-spain
Actualización de mercado,"BTC se dirige a un cierre semanal desastroso mientras el precio de bitcoin consigue un rechazo en USD 20,000","Se siente como 2018 de nuevo, ya que el viejo nivel de resistencia de varios años de bitcoin ha regresado con una venganza",William Suberg,19 Jun 2022,https://cointelegraph.com/news/bitcoin-heads-for-dismal-weekly-close-as-btc-price-rejects-at-20k
Opinión,"Bitcoin y la Reserva Federal: El precio, la volatilidad y la inflación",¿Se nos viene una recesión económica? ¿Por qué tanta volatilidad?  ¿Qué pasará con el precio de Bitcoin? ¿Cuál es el rol de la Reserva Federal de los Estados Unidos?,Gustavo Godoy,13 Apr 2022,https://cointelegraph.com/news/bitcoin-and-the-federal-reserve-price-volatility-and-inflation
Noticias,Solo para el comercio exterior: el Banco de Rusia se opone a la inversión gratuita de criptomonedas,"El gobierno ruso no quiere habilitar Bitcoin para los rusos comunes, sino exclusivamente para las entidades de comercio exterior.",Helen Partz,16 Dec 2022,https://cointelegraph.com/news/only-for-foreign-trade-bank-of-russia-stands-against-free-crypto-investment
Noticias,"Drenaron USD 100 millones de la plataforma DeFi de Solana Mango Markets, lo que hace que el token se desplome un 52%",La tesorería de la plataforma fue drenada de más de USD 100 millones en criptomonedas después de que un atacante manipulara los datos del precio de su token nativo para tomar préstamos contra sus holdings.,Jesse Coghlan,12 Oct 2022,https://cointelegraph.com/news/100m-drained-from-solana-defi-platform-mango-markets-token-plunges-52
Noticias,"El cofundador de Celsius, Daniel Leon, sigue a Mashinsky en la dimisión de los ejecutivos del espacio de las criptomonedas","Leon es al menos el octavo ejecutivo del sector de las criptomonedas que dimite en los últimos meses; el director general de Celsius, Alex Mashinsky, dimitió hace una semana.",Derek Andersen,05 Oct 2022,https://cointelegraph.com/news/celsius-co-founder-daniel-leon-follows-mashinsky-out-as-crypto-exec-flight-continues
Altcoin en detalle,THORChain tiene buen desempeño en el criptomercado. ¿Podría el precio de RUNE superar los USD 10?,"THORChain revela planes para lanzar la moneda estable nativa similar a UST de Terra y ""Thorfi"".",Yashu Gola,15 Mar 2022,https://cointelegraph.com/news/thorchain-quietly-outperforms-crypto-market-in-q1-can-rune-price-break-10-next
Noticias,"Un ex banquero central chino afirma que el uso del yuan digital ""ha sido bajo""","Un ex banquero central chino dijo que las transacciones acumuladas de e-CNY solo superaron los USD 14,000 millones en dos años, y añadió que los resultados ""no eran ideales"".",Jesse Coghlan,30 Dec 2022,https://cointelegraph.com/news/former-chinese-central-banker-says-digital-yuan-usage-has-been-low
Noticias,Convocan a startups a un hackatón para crear soluciones basadas en blockchain y DeFi,Blockchain Land llama a startups a competir por premios en dólares para desarrollar aplicaciones en blockchain y DeFi,Matías Nahuel Castro,15 Sep 2022,https://cointelegraph.com/news/startups-invited-to-hackathon-to-create-blockchain-and-defi-based-solutions
Noticias,Informe: Indonesia impondrá un impuesto sobre las criptomonedas del 0.1% a partir de mayo,"Al parecer, el gobierno todavía está estudiando cómo aplicar el impuesto, pero la legislación aprobada en respuesta a la pandemia sentó las bases.",Turner Wright,01 Apr 2022,https://cointelegraph.com/news/indonesia-to-impose-0-1-crypto-tax-starting-in-may-report
Noticias de Última Hora,Coinbase llega a un acuerdo de USD 100 millones con los reguladores de Nueva York,"Los reguladores declararon que la empresa tenía un retraso de 100,000 alertas sobre posibles transacciones sospechosas de clientes.",Turner Wright,04 Jan 2023,https://cointelegraph.com/news/coinbase-reaches-100m-settlement-with-ny-regulators
Noticias del mercado,BTC acaba de volver a entrar en una zona de precios clave que ha señalado el principio del fin de fases bajistas anteriores,El rango dinámico NVT vuelve a niveles vistos solo dos veces en dos años: durante la caída ocasionada por el coronavirus de marzo de 2020 y la reacción del año pasado tras el cierre de las mineras chinas.,William Suberg,24 Jan 2022,https://cointelegraph.com/news/bitcoin-enters-value-zone-as-btc-price-floor-metric-goes-green-again
Noticias,"El noroeste de Arkansas ofrece USD 10,000 en Bitcoin para atraer a trabajadores a distancia","""El talento de la próxima generación es esencial para seguir transformando nuestra región en un centro de innovadores y empresas tecnológicas emergentes"", dijo la directora del Blockchain Center of Excellence, Mary Lacity.",Turner Wright,12 Jan 2022,https://cointelegraph.com/news/northwest-arkansas-offering-10k-in-bitcoin-to-attract-remote-workers
Noticias,El banco suizo Sygnum lanza el staking Cardano,Cardano se une al creciente portafolio de staking de criptomonedas de Sygnum.,Helen Partz,02 Aug 2022,https://cointelegraph.com/news/swiss-sygnum-bank-expands-crypto-staking-with-cardano
Noticias,Operador de minería de Bitcoin con sede en Texas presenta una oferta pública inicial de USD 60 millones,"La solicitud está a la espera de la aprobación del organismo regulador financiero de Estados Unidos, la SEC.",Tom Farren,09 Apr 2022,https://cointelegraph.com/news/applied-blockchain-inc-files-for-60m-ipo
Noticias,Un ex banquero de Goldman Sachs explica por qué la gente de Wall Street se equivoca con respecto a Bitcoin,"Según John Haar, que solía contarse entre las filas del campo de las finanzas tradicionales, una comprensión fundamental del ""dinero sólido"" está impidiendo que Wall Street adopte Bitcoin.",Brian Newar,17 Aug 2022,https://cointelegraph.com/news/former-goldman-sachs-banker-explains-why-wall-street-gets-bitcoin-wrong
Noticias,La adopción de criptomonedas en EE.UU. sigue siendo alta a pesar del temor a la inflación mundial,El nuevo informe de DappRadar ofrece una amplia perspectiva sobre cómo le fue al espacio de las criptomonedas y la Web 3.0 durante el primer trimestre de 2022.,Tom Farren,29 Apr 2022,https://cointelegraph.com/news/us-crypto-adoption-remains-high-despite-global-inflation-fears
Noticias,"Los costes de la minería de BTC alcanzan su nivel más bajo en 10 meses, ya que los mineros utilizan equipos más eficientes","Ahora cuesta menos minar un solo bitcoin, lo que podría ayudar a invertir la tendencia a la baja de la rentabilidad y a reducir la demanda de energía en la red.",Martin Young,15 Jul 2022,https://cointelegraph.com/news/btc-mining-costs-reach-10-month-lows-as-miners-use-more-efficient-rigs
Noticias,"Según VanEck, el precio de Bitcoin podría alcanzar los USD  4.8 millones si se convirtiera en el activo de reserva mundial",La empresa de inversión hizo una valoración muy alta para BTC y el oro basándose en el caso extremo de que cualquiera de los dos se convierta en la moneda mundial de reserva.,Brian Newar,01 Apr 2022,https://cointelegraph.com/news/vaneck-says-bitcoin-could-hit-4-8m-if-it-became-the-global-reserve-asset
Noticias,"Bitcoin es escasez y no mercancía, definió el CEO de MicroStrategy",Michael Saylor de MicroStrategy afirma que Bitcoin es la única escasez real,Matías Nahuel Castro,18 Mar 2022,https://cointelegraph.com/news/bitcoin-is-scarcity-not-commodity-defined-microstrategy-ceo
Noticias,Twitter y Stripe lanzan un programa de pagos con USDC para creadores de contenido a través de Polygon,"Además de los pagos a cuentas bancarias y tarjetas de débito, los selectos creadores de contenido ahora pueden elegir que las ganancias de USDC se envíen a sus billeteras.",Zhiyuan Sun,22 Apr 2022,https://cointelegraph.com/news/twitter-and-stripe-roll-out-usdc-payout-program-for-creators-via-polygon
Noticias,El gobierno surcoreano confiscó USD 180 millones en criptomonedas por impago de impuestos desde 2021,El país comenzó a incautar criptomonedas para compensar los atrasos fiscales el año pasado.,Zhiyuan Sun,22 Sep 2022,https://cointelegraph.com/news/south-korean-gov-has-confiscated-260b-kwr-in-crypto-for-non-payment-of-taxes-since-2021
Entrevista,"Sergio “Kun” Agüero:  “El metaverso es una manera inmersiva, interactiva y activa de encontrarme con mi audiencia”","¿Qué es el Kuniverse? Entrevistamos el ""Kun"" Agüero, un conocido streamer e influencer en el mundo de los eSports",Fernando Quirós,04 Nov 2022,https://cointelegraph.com/news/sergio-kun-aguero-the-metaverse-is-an-immersive-interactive-and-active-way-to-meet-my-audience
Noticias,"El spam de criptomonedas aumenta un 4,000% en dos años: LunarCrush","LunarCrush ha revelado que el spam en la criptosfera ha aumentado en un sorprendente 3,894%.",Martin Young,27 May 2022,https://cointelegraph.com/news/crypto-spam-increases-4000-in-two-years-lunarcrush
Noticias,"Los juegos de NFT tienen ventaja sobre los de ""entrada y salida de dinero"", dice Urvit Goel, de Polygon",Los juegos que integran tokens no fungibles tienen una ventaja natural sobre los juegos tradicionales que no les permiten a los usuarios vender sus objetos dentro del juego.,Brian Newar,15 Aug 2022,https://cointelegraph.com/news/nft-games-have-edge-over-money-in-no-money-out-games-polygon-s-urvit-goel
Noticias,Chainalysis lanza herramientas gratuitas de detección de sanciones,La empresa de análisis de datos blockchain Chainalysis anunció el lanzamiento acelerado de dos herramientas de detección de sanciones para ayudar a proporcionar una mayor supervisión regulatoria a los exchanges y proyectos DeFi.,Tom Mitchelhill,11 Mar 2022,https://cointelegraph.com/news/chainalysis-launches-free-sanctions-screening-tools
Entrevista,¿Por qué un alcalde guatemalteco está minando Bitcoin?,"Un proyecto de Bitcoin en Guatemala ha limpiado el aire, ha contribuido a la minería de Bitcoin con emisiones negativas de carbono y ha puesto un minero de BTC en manos del alcalde local.",Joseph Hall,04 Apr 2022,https://cointelegraph.com/news/why-is-a-guatemalan-mayor-mining-bitcoin-tackling-fud-with-biogas-and-btc
Noticias,"Sequoia Capital China habría recaudado USD 9,000 millones","Sequoia China es conocida por financiar a muchas firmas de criptomonedas, incluido el desacreditado prestamista de criptomonedas Babel Finance, que detuvo los retiros a mediados de junio.",Helen Partz,05 Jul 2022,https://cointelegraph.com/news/crypto-investor-sequoia-capital-china-reportedly-raises-9-billion
Noticias,12 entidades independientes prometen apoyo legal a Ripple,"Las pruebas se acumulan a medida que los ""amigos del tribunal"" se alinean en apoyo de Ripple Labs.",Martin Young,04 Nov 2022,https://cointelegraph.com/news/you-have-our-swords-12-independent-entities-pledge-legal-support-for-ripple
Opinión,"Invertir en criptomonedas sólo es apto para personas con un perfil propenso al riesgo, según un experto",Los criptoactivos vienen llamando la atención de los interesados ​​en diversificar su cartera,Rodrigo Di Paula Ambrissi,17 Oct 2022,https://cointelegraph.com/news/investing-in-cryptocurrencies-is-only-suitable-for-risk-prone-individuals-expert-says
