label,title,description,autor,date,url
Noticias,Celebraron en Lima evento oficial de Polkadot y Kusama en Español,Lima se convirtió en sede del primer evento oficial de Polkadot y Kusuma en Español.,Daniel Jimenez,16 Dec 2021,https://cointelegraph.com/news/official-polkadot-and-kusama-in-spanish-event-held-in-lima
Altcoin en detalle,Komodo (KMD) sube un 54% tras un gran impulso para ampliar la interoperabilidad con AtomicDEX,El precio de KMD se disparó luego de que el proyecto añadiera soporte para 13 redes blockchain y anunciara sus planes de lanzar una colección de NFT.,Jordan Finneseth,22 Feb 2022,https://cointelegraph.com/news/komodo-kmd-rallies-54-after-major-push-to-expand-interoperability-with-atomicdex
Noticias,Uniswap contempla la financiarización de los NFT y conversa con protocolos de préstamos,"En un tuit del jefe de producto de NFT, el exchange está supuestamente en contacto con varios protocolos de préstamos de NFT para construir la financiarización de NFT.",Savannah Fortis,24 Aug 2022,https://cointelegraph.com/news/uniswap-eyes-nft-financialization-in-talks-with-lending-protocols
Video,¿Qué significa la lucha de la Fed contra la inflación para las criptomonedas? Lyn Alden lo explica,La analista Lyn Alden explica por qué los esfuerzos de la Fed para frenar la inflación pueden tardar más de lo previsto y cómo afectarán a los mercados de criptomonedas.,Marco Castrovilli,05 Sep 2022,https://cointelegraph.com/news/what-does-the-fed-s-fight-against-inflation-mean-for-crypto-macro-analyst-explains
Noticias,"El metaverso de Sandbox llega a 2 millones de usuarios, comienza la asociación con K-Pop","Hay 200 misiones en las que los jugadores pueden completar para tener la oportunidad de obtener un NFT Alpha Pass, que recompensará a los propietarios con hasta 1,000 SAND por un valor aproximado de USD 3,000 a los precios actuales.",Brian Quarmby,04 Mar 2022,https://cointelegraph.com/news/the-sandbox-metaverse-hits-2m-users-begins-k-pop-partnership
Noticias,Telefónica Tech unió alianza con LACChain para promover la adopción de la tecnología blockchain en LATAM y el Caribe,Telefónica Tech ahora forma parte de la alianza global de LACChain para seguir fomentando la educación y adopción del blockchain.,Daniel Jimenez,10 Feb 2022,https://cointelegraph.com/news/telefonica-tech-joined-an-alliance-with-lacchain-to-promote-the-adoption-of-blockchain-technology-in-latam-and-the-caribbean
Noticias,El diputado estadounidense Tom Emmer exige a la secretaria Yellen una explicación sobre las sanciones de la OFAC a Tornado Cash,El republicano de Minnesota destacó los problemas prácticos que supuestamente podrían surgir de la inclusión de direcciones de contratos inteligentes en la lista SDN en una serie de preguntas puntuales.,Derek Andersen,23 Aug 2022,https://cointelegraph.com/news/rep-emmer-demands-an-explanation-of-ofac-s-tornado-cash-sanction-from-sec-yellen
Noticias,"El protocolo de préstamo de NFT, BendDAO, propone cambios de emergencia en medio de la crisis crediticia","""Lamentamos haber subestimado lo ilíquidos que podrían ser los NFT en un mercado bajista al establecer los parámetros iniciales"", dice el equipo de desarrollo de BendDAO.",Zhiyuan Sun,22 Aug 2022,https://cointelegraph.com/news/nft-lending-protocol-bend-dao-proposes-emergency-changes-amid-credit-crisis
Noticias,“Ricardo el Reno Rebelde de Santa Claus” es el NFT con el que Iboo Agency incursiona en el metaverso de forma independiente,Iboo Agency de España creó su propia pieza NFT con motivo navideño para felicitar a sus trabajadores en navidad la cual se encuentra en venta en Opensea.,Daniel Jimenez,28 Dec 2021,https://cointelegraph.com/news/ricardo-the-rebellious-reindeer-of-santa-claus-is-the-nft-with-which-iboo-agency-ventures-into-the-metaverse-independently
Noticias,Canadá albergará la nueva instalación de criptominería de 28 MW de Bitfury,"Se espera que la nueva instalación de criptominería en Sarnia, Ontario, opere a 16 megavatios para fines de este mes y se escalará para operar a 28 MW en mayo.",Arijit Sarkar,23 Feb 2022,https://cointelegraph.com/news/canada-to-host-bitfury-s-new-28mw-crypto-mining-facility
Opinión,"""Blockchain revolucionará el sistema financiero"", dice criptoinversor de 15 años",Brasil tiene enormes desafíos en el futuro para atender las necesidades tecnológicas y dar soporte y constancia al mercado de las criptomonedas,Rodrigo Di Paula Ambrissi,07 Aug 2022,https://cointelegraph.com/news/blockchain-will-revolutionize-financial-system-says-15-year-old-crypto-investor
Noticias,CleanSpark adquiere una instalación minera en Georgia por USD 33 millones,"Es el segundo acuerdo que la empresa anuncia esta semana citando ""un precio sustancialmente reducido"".",Ana Paula Pereira,09 Sep 2022,https://cointelegraph.com/news/cleanspark-acquires-mining-facility-in-georgia-for-33-million
Noticias,Injective se asocia con Wormhole para llevar 10 nuevas blockchains a la plataforma,"""Los usuarios pronto encontrarán Wormhole integrado en el backend de Injective Bridge, por lo que la transferencia de activos de distintas cadenas EVM o Solana se puede hacer con el simple clic de un botón"", declaró Injective Labs.",Brian Quarmby,26 May 2022,https://cointelegraph.com/news/injective-partners-with-wormhole-to-bring-10-new-blockchains-to-the-network
Noticias,La SEC de Filipinas advierte contra los exchange de criptomonedas sin licencia tras el colapso de FTX,La Comisión de Bolsa y Valores de Filipinas subrayó que es ilegal ofrecer a los filipinos acceso a exchanges no registrados.,Ezra Reguerra,27 Dec 2022,https://cointelegraph.com/news/philippine-sec-warns-against-unlicensed-crypto-exchanges-amid-ftx-collapse
Noticias,El Banco de Rusia respalda los pagos transfronterizos con criptomonedas frente al comercio nacional,"Las criptomonedas pueden utilizarse en pagos transfronterizos o internacionales sólo si no entran en el sistema financiero nacional de Rusia, dijo el gobernador del Banco de Rusia.",Helen Partz,16 Jun 2022,https://cointelegraph.com/news/bank-of-russia-backs-cross-border-crypto-payments-vs-domestic-trade
Noticias,Huobi y Gate.io en la mira por presuntamente compartir instantáneas usando fondos prestados,"Una dirección de monedero vinculada al exchange Huobi fue encontrada transfiriendo 10,000 ETH a monederos de depósito de Binance y OKX poco después de publicar su instantánea de activos",Arijit Sarkar,13 Nov 2022,https://cointelegraph.com/news/huobi-and-gate-io-under-fire-for-allegedly-sharing-snapshots-using-loaned-funds
Noticias del mercado,"Los últimos niveles de soporte de Bitcoin por encima de los USD 20,000 entran en juego mientras el precio de BTC atraviesa ""momentos de incertidumbre""","Un analista se prepara para una posible caída por debajo de los USD 30,000, ya que los niveles de soporte históricos siguen estando lejos del precio actual al contado de Bitcoin.",William Suberg,24 Feb 2022,https://cointelegraph.com/news/last-bitcoin-support-levels-above-20k-come-into-play-as-btc-price-faces-time-of-uncertainty
Noticias,"Jimmy Song en Labitconf: “En el mundo de hoy vemos que los gobiernos tienden al control, a la centralización y a la falta de libertad”","""La burocracia crece como un cáncer que destruye la civilización"", dijo Jimmy Song",Fernando Quirós,12 Nov 2022,https://cointelegraph.com/news/jimmy-song-at-labitconf-in-todays-world-we-see-that-governments-tend-towards-control-centralization-and-lack-of-freedom
Noticias,El panorama sudafricano de las criptomonedas se prepara para el crecimiento de TradFi tras la sentencia de la FSCA,Los expertos del sector creen que la medida de Sudáfrica de clasificar las criptomonedas como productos financieros podría impulsar la adopción y legitimidad del sector.,Gareth Jenkinson,25 Oct 2022,https://cointelegraph.com/news/south-african-crypto-landscape-primed-for-tradfi-growth-after-fsca-ruling
Noticias,Expertos aconsejan cómo estar al día con la declaración de criptomonedas en el IRPF en España,Algunos consejos sobre cómo estar al día con la declaración de criptomonedas en el IRPF en España,Rodrigo Di Paula Ambrissi,29 Jun 2022,https://cointelegraph.com/news/expert-advises-on-how-to-keep-up-to-date-with-cryptocurrency-income-tax-declarations-in-spain
Noticias,La Comisión de Derecho del Reino Unido revisará las leyes internacionales sobre criptomonedas para considerar reformas legales,La autoridad de revisión legal trabajará para recopilar propuestas de reforma de la ley para su consulta pública en el segundo semestre de 2023.,Gareth Jenkinson,18 Oct 2022,https://cointelegraph.com/news/uk-law-commission-to-review-international-laws-on-crypto-to-consider-legal-reforms
Análisis de Mercado,"¿Un giro bajista de Ethereum? El impulso del precio de ETH se desvanece tras el rechazo del nivel de USD 1,600","Ether corre el riesgo de seguir cayendo por debajo de los USD 1,350 en agosto, ya que el repunte del precio de ETH está perdiendo fuerza.",Yashu Gola,25 Jul 2022,https://cointelegraph.com/news/ethereum-s-bearish-u-turn-eth-price-momentum-fades-after-1-6k-rejection
Noticias,El precio de Bitcoin ha subido entre un 7% y un 36% en la primera semana de enero de cada año desde 2018,"Algunos analistas esperan grandes cosas para Bitcoin en un futuro próximo, cuando toda la venta institucional haya terminado y el capital se despliegue en el mercado.",Brian Newar,31 Dec 2021,https://cointelegraph.com/news/bitcoin-has-risen-7-to-36-in-the-first-week-of-january-each-year-since-2018
Opinión,La Fed será más agresiva: ¿Qué significa esto para el precio de Bitcoin?,"Como de costumbre, el mercado sobrereacciona. Cierto, la inflación se salió de control y la Fed debe ajustar el cinturón antes de lo anticipado.",Gustavo Godoy,10 Jan 2022,https://cointelegraph.com/news/the-fed-will-be-more-aggressive-what-does-this-mean-for-the-price-of-bitcoin
Noticias,El presupuesto federal australiano reafirma que no se tratará a BTC como moneda extranjera,"El presupuesto federal afirma que bitcoin se acogerá al ""tratamiento fiscal actual de las monedas digitales, incluido el tratamiento fiscal de las ganancias de capital, cuando se mantengan como una inversión"".",Brian Quarmby,27 Oct 2022,https://cointelegraph.com/news/aussie-federal-budget-reaffirms-btc-won-t-be-treated-as-foreign-currency
Noticias,Fidelity reduce el valor de sus participaciones en Twitter,Fidelity ha reducido el valor de su inversión en Twitter en más de la mitad de su participación inicial en la adquisición de la plataforma de redes sociales por parte de Elon Musk.,Gareth Jenkinson,06 Jan 2023,https://cointelegraph.com/news/fidelity-downsizes-value-of-its-twitter-holdings
Noticias,El director de tecnología de Ripple arremete contra Vitalik Buterin por su palo a XRP,"David Schwartz comparó a los mineros de criptomonedas en los ecosistemas de Ethereum y Bitcoin con accionistas de eBay, lo que, en su opinión, hace que BTC y ETH también sean valores.",Prashant Jha,18 Aug 2022,https://cointelegraph.com/news/ripple-cto-lashes-back-at-vitalik-buterin-for-his-dig-on-xrp
Noticias,El regulador financiero de Nueva York multa con USD 30 millones a la división de criptomonedas de Robinhood,"""A medida que su negocio crecía, Robinhood Crypto no invirtió los recursos y la atención adecuados para desarrollar y mantener una cultura de cumplimiento"", dijo la superintendente Adrienne Harris.",Turner Wright,02 Aug 2022,https://cointelegraph.com/news/new-york-financial-regulator-fines-robinhood-s-crypto-division-30m
Análisis de Precios,"Análisis de precios del 19 de enero: BTC, ETH, BNB, ADA, SOL, XRP, LUNA, DOT, AVAX, DOGE","La presión de venta sobre BTC y las altcoins está comenzando a disminuir, pero los datos sugieren que es demasiado pronto para sugerir a una reversión de tendencia.",Rakesh Upadhyay,19 Jan 2022,https://cointelegraph.com/news/price-analysis-1-19-btc-eth-bnb-ada-sol-xrp-luna-dot-avax-doge
Noticias,"Singapur presenció un salto de 13 veces en las inversiones de criptomonedas en 2021, revela un informe de KPMG","KPMG prevé que la inversión en criptomonedas en Singapur se mantendrá fuerte este año, a pesar del creciente escrutinio regulatorio.",Arnold Kirimi,08 Feb 2022,https://cointelegraph.com/news/singapore-saw-13x-jump-in-crypto-investments-in-2021-kpmg
Opinión,"Top criptonoticias de la semana: BC de España experimentará con una CBDC, la SEC presentará cargos contra SBF, Microsoft prohíbe la minería cripto en la nube y más","Un breve repaso de cuáles fueron las criptonoticias más destacadas de la semana para que no te pierdas ningún detalle sobre lo que está pasando en el mundo sobre bitcoin, blockchain y el ecosistema cripto.",Gustavo Godoy,16 Dec 2022,https://cointelegraph.com/news/top-crypto-news-of-the-week-spains-bc-to-experiment-with-cbdc-sec-to-file-charges-against-sbf-microsoft-bans-cloud-crypto-minin
Recapitulación de evento,Positividad en un mercado bajista: Economía Blockchain Estambul 2022,La cumbre Blockchain Economy Istanbul 2022 dejó una cosa clara: la positividad del ecosistema de las criptomonedas no se ve afectada por las turbulentas sacudidas del mercado.,Erhan Kahraman,30 Jul 2022,https://cointelegraph.com/news/positivity-blazing-through-a-bear-market-blockchain-economy-istanbul-2022
Noticias,Las autoridades surcoreanas investigan al personal de Terra,"Al parecer, las autoridades surcoreanas están estudiando la caída de Terra para comprobar si hay indicios de manipulación intencionada de los precios y otros problemas.",Helen Partz,30 May 2022,https://cointelegraph.com/news/south-korean-authorities-reportedly-probe-staff-behind-terra
Opinión,¿La regulación de criptomonedas en Colombia anda mal?,"Renata Rodrigues, gerente senior de Marketing Global de Paxful y Samuel Barbosa, co-fundador del Local Proyecto Terra, conversaron sobre Colombia y la regulación cripto",Cointelegraph en Español,22 Mar 2022,https://cointelegraph.com/news/is-the-regulation-of-cryptocurrencies-in-colombia-wrong
Noticias,Kiln cierra una ronda de financiación de USD 17.8 millones y mira a la futura demanda del staking de ETH,"La empresa de infraestructuras de staking ha cerrado una ronda de financiación de USD 17.8 millones liderada por empresas como Consensys, GSR y Kraken Ventures.",Gareth Jenkinson,28 Nov 2022,https://cointelegraph.com/news/staking-tech-firm-kiln-closes-17-8-million-eyes-future-eth-staking-demand
Noticias,El CEO de Swipe dejará su cargo una vez que Binance complete la adquisición de la empresa,El exchange adquirió una participación mayoritaria en Swipe en julio de 2020 como parte de un esfuerzo más amplio para impulsar la adopción masiva de los criptopagos.,Arnold Kirimi,30 Dec 2021,https://cointelegraph.com/news/binance-to-finalize-acquisition-of-swipe-paving-for-ceo-exit
Noticias,"Según los datos on-chain, FTX US suspende los retiros",La noticia llega menos de 24 horas después de que la plataforma emitiera un aviso en el que instaba a sus usuarios a cerrar sus posiciones ante la posible suspensión del trading.,Judith BannermanQuist,11 Nov 2022,https://cointelegraph.com/news/ftx-us-suspends-withdrawals-according-to-on-chain-data
Noticias,"Aave lanza la red social, Lens Protocol","Aave pretende empoderar a los creadores de contenidos para que sean ""dueños de sus raíces digitales"" y pide a los desarrolladores que construyan una experiencia social más sostenible basada en contratos inteligentes.",Ornella Hernández,09 Feb 2022,https://cointelegraph.com/news/aave-launches-web3-social-media-platform-lens-protocol
Noticias,La economista jefe de Israel expone sus recomendaciones para la regulación de las criptomonedas,La economista jefe dijo que el Supervisor de Proveedores de Servicios Financieros y la Autoridad de Valores de Israel deberían recibir más poderes para supervisar la industria.,Brayden Lindrea,29 Nov 2022,https://cointelegraph.com/news/israel-s-chief-economist-lays-out-recommendations-for-crypto-regulation
Actualización de mercado,"El precio de bitcoin se rechaza al nivel de USD 24,000, mientras que la 'configuración bajista clásica' arruina la diversión de los alcistas","El nivel de precio de BTC de USD 24,000 se niega a tornarse en soporte, mientras que el cierre semanal permanece enmarcado en incertidumbre.",William Suberg,29 Jul 2022,https://cointelegraph.com/news/bitcoin-price-rejects-at-24k-as-classic-short-setup-spoils-bulls-fun
Noticias,Casi 1 millón de dólares en criptomonedas fueron robados en una explotación a una dirección de vanidad,"El hacker robó 732 ETH por valor de unos USD 950,000 y los envió al sancionado mezclador Tornado Cash.",Ezra Reguerra,26 Sep 2022,https://cointelegraph.com/news/almost-1m-in-crypto-stolen-from-vanity-address-exploit
Opinión,El token de la plataforma Telegram es el gran ganador de la jornada con un alza de doble dígito en su precio,"El token del proyecto del equipo detrás de Telegram, el token TON es el gran ganador de la jornada de hoy con un alza en su precio de hasta once puntos porcentuales según Coinmarketcap",Daniel Jimenez,14 Dec 2022,https://cointelegraph.com/news/telegram-platform-token-is-the-big-winner-of-the-day-with-a-double-digit-rise-in-price
Noticias,El consejo regulador canadiense crea un nuevo registro previo para las plataformas de criptomonedas,Los administradores de valores canadienses exigirán a las plataformas de trading de criptomonedas que presenten un compromiso en el que se comprometan a proteger a los inversores mientras se tramita su registro.,Derek Andersen,15 Aug 2022,https://cointelegraph.com/news/canadian-regulatory-council-creates-new-preregistration-filing-for-crypto-platforms
Noticias del mercado,Las pérdidas de BTC se hacen reales mientras la métrica SOPR alcanza el mínimo desde marzo de 2020,"El precio de venta frente al precio pagado presenta la mayor divergencia en más de dos años desde el último ""cisne negro"" de Bitcoin.",William Suberg,15 Nov 2022,https://cointelegraph.com/news/btc-losses-get-real-as-bitcoin-sopr-metric-hits-lowest-since-march-2020
Noticias,Lobistas de Singapur se oponen a la prohibición general propuesta de prestar tokens de criptomonedas,Los comentarios se dieron en respuesta a una prohibición propuesta por la Autoridad Monetaria de Singapur publicada en octubre.,Ezra Reguerra,06 Jan 2023,https://cointelegraph.com/news/singapore-s-lobbyists-oppose-proposed-blanket-ban-on-lending-crypto-tokens
Noticias,"El CEO de Robinhood expone cómo DOGE podría convertirse en la ""moneda de Internet""","El director general de Robinhood, Vladimir Tenev, acudió a Twitter para explicar cómo DOGE podría convertirse en ""la futura moneda de Internet"", apenas unas horas después de que el creador de Dogecoin criticara a Elon Musk por sus tonterías en Twitter.",Tom Mitchelhill,15 Apr 2022,https://cointelegraph.com/news/robinhood-ceo-outlines-how-doge-could-become-currency-of-the-internet
Newsletter,Crypto Biz: La subasta de Voyager Digital ha terminado. ¿Y ahora?,"FTX US fue el ganador de la subasta de los activos de Voyager. Sin embargo, una persona del sector dijo a Cointelegraph que el acuerdo no tenía en cuenta los intereses de los usuarios.",Sam Bourgi,30 Sep 2022,https://cointelegraph.com/news/crypto-biz-the-voyager-digital-auction-is-over-what-now
Noticias,Celsius ha pagado 143 millones en préstamos de DAI desde el 1 de julio,"El precio de liquidación sobre el préstamo de Bitcoin de Celsius ha caído a menos de USD 5,000, según datos de la industria DeFi.",Sam Bourgi,04 Jul 2022,https://cointelegraph.com/news/celsius-pays-down-143m-in-dai-loans-since-july-1
Noticias,Se sellan patrocinios deportivos en medio de las turbulencias del mercado: el Manchester City firma un acuerdo con OKX,Los aficionados del Manchester City también tendrán la oportunidad de ganar abonos en el OKX Hospitality Box mediante el escaneo de códigos QR en el arte callejero encargado por el criptoexchange.,Brian Quarmby,11 Jul 2022,https://cointelegraph.com/news/sports-sponsorships-sealed-amid-market-turmoil-as-man-city-inks-deal-with-okx
Noticias,La producción de bitcoin de Marathon en el segundo trimestre del año baja un 44%,"La producción de bitcoin de Marathon cayó en picado en el segundo trimestre, pero la empresa insiste en que está buscando expandirse a nuevas ubicaciones y trabajando en la recuperación de las instalaciones nuevas y existentes.",Brian Newar,08 Jul 2022,https://cointelegraph.com/news/marathon-q2-bitcoin-production-down-44-as-fleet-remains-crippled
Noticias,Blockchain Association apoya a Ripple en su duelo con la SEC,"Blockchain Association ha presentado un informe amicus, también conocido como ""amigo del tribunal"" para apoyar a Ripple Labs.",Stephen Katte,31 Oct 2022,https://cointelegraph.com/news/blockchain-association-throws-support-behind-ripple-in-sec-duel
Noticias,El colapso de FTX hace que los planes de la ciudad de Busan respecto a su exchange de criptomonedas se replanteen,"La administración de la ciudad de Busan ha firmado acuerdos con múltiples empresas de criptomonedas, como Binance, Huobi Global y Crypto.com, así como con el exchange FTX",Helen Partz,23 Nov 2022,https://cointelegraph.com/news/ftx-collapse-triggers-second-thoughts-on-busan-city-s-crypto-exchange-plans
Actualización de mercado,"El precio de Bitcoin alcanza mínimos de 10 semanas mientras el nivel de los USD 40,000 se convierte en una ""desagradable"" trampa alcista",Una reversión completa y algo más para BTC significa que los alcistas están aceptando los niveles actuales tras meses de una severa tendencia a la baja.,William Suberg,05 May 2022,https://cointelegraph.com/news/bitcoin-price-hits-10-week-lows-as-40k-spike-becomes-nasty-bull-trap
Noticias,"El gobernador de California, Newsom, veta la concesión de licencias y el marco regulador de las criptomonedas","Al oponerse al proyecto de ley 2269 de la Asamblea, Newsom recomendó un ""enfoque más flexible"" que evolucionara con el tiempo teniendo en cuenta la seguridad de los consumidores y los costes correspondientes.",Arijit Sarkar,25 Sep 2022,https://cointelegraph.com/news/california-gov-newsom-vetoes-crypto-licensing-and-regulatory-framework
Actualización de mercado,"Alcistas de Bitcoin protegen el nivel de USD 17,000 mientras un trader considera a China el catalizador clave de precios de BTC",China ofrece un potencial indicador líder para la fortaleza del precio de Bitcoin con los datos económicos de EE. UU. que se publicarán la próxima semana.,William Suberg,10 Dec 2022,https://cointelegraph.com/news/bitcoin-bulls-protect-17k-as-trader-eyes-key-china-btc-price-catalyst
Noticias,La Ethereum Foundation elimina el nombre Eth2 en su cambio de marca,"""Al eliminar la terminología Eth2, ahorramos a todos los futuros usuarios la navegación por este confuso modelo mental"", declaró la Ethereum Foundation",Brian Quarmby,26 Jan 2022,https://cointelegraph.com/news/eth2-is-no-more-after-ethereum-foundation-ditches-name-in-rebrand
Opinión,Bitcoin vs oro: ¿Qué dijo (realmente) Mark Cuban?,"Mark Cuban nos dice que el oro es para tontos. Aquí el debate oro vs bitcoin. De pronto, no todo es lo que parece.",Gustavo Godoy,04 Jan 2023,https://cointelegraph.com/news/bitcoin-vs-gold-what-did-mark-cuban-really-say
Noticias,¿Se ha tocado fondo? La comunidad cripto comparte sus opiniones,"Desde esperar que los precios del Bitcoin bajen hasta esperar que la diversión continúe, los miembros de la comunidad compartieron sus opiniones sobre los precios de las criptomonedas.",Ezra Reguerra,23 Sep 2022,https://cointelegraph.com/news/is-the-bottom-in-crypto-community-shares-their-thoughts
Newsletter,Crypto Biz: NYDIG acumula satoshis mientras Elon compra Twitter,"En medio del mercado bajista, siguen apareciendo signos positivos de adopción de las criptomonedas. Además, Elon Musk finalmente avanza en sus planes de adquirir Twitter.",Sam Bourgi,07 Oct 2022,https://cointelegraph.com/news/crypto-biz-nydig-stacks-sats-elon-buys-twitter
Opinión,4 hechos que muestran por qué la realidad aumentada está revolucionando el comercio,"Cómo la realidad aumentada está cambiando aspectos de la sociedad, mira lo que dice la investigación sobre el tema",Rodrigo Di Paula Ambrissi,25 Jul 2022,https://cointelegraph.com/news/4-facts-that-show-why-augmented-reality-is-revolutionizing-commerce
Noticias,La nueva stablecoin basada en el oro del gigante del comercio Mitsui está en camino,"Al parecer, Mitsui está planeando lanzar su stablecoin vinculada al oro antes que DCJPY, otro importante proyecto de stablecoin japonés.",Helen Partz,04 Feb 2022,https://cointelegraph.com/news/new-gold-based-stablecoin-by-trading-giant-mitsui-reportedly-on-the-way
Noticias,"El impuesto a las criptomonedas puede esperar, las monedas gratuitas no: Corea del Sur estudia un ""impuesto sobre los regalos"" para los airdrops",Corea del Sur aplazó su impuesto sobre las ganancias con criptomonedas en múltiples ocasiones debido a la falta de medidas de protección de los inversores y de directrices reguladoras.,Prashant Jha,22 Aug 2022,https://cointelegraph.com/news/crypto-tax-can-wait-free-coins-can-t-s-korea-mulls-gift-tax-for-airdrops
Noticias,El proyecto de ley para prohibir los activos digitales como medio de pago ha sido aprobado en primera lectura en el Parlamento ruso,"El documento incurre en varias contradicciones conceptuales, al tratar de calificar los tokens de valor como un sustituto monetario.",David Attlee,15 Jun 2022,https://cointelegraph.com/news/bill-to-ban-digital-assets-as-payment-passed-the-first-reading-in-the-russian-parliament
